0,1,2,3,4,5
tt0113092,"David Douglas, Tim Douglas","David Douglas, Christopher Salazar",3.4,1h 40min,Earth is in a state of constant war and two colonies of humans have been sent to a far away world. The colonists create a new civilization but have inherited the worst traits of their forebears and war breaks out leaving the new cities in ruins. It falls to a bunch of teens to bring peace to the colony - but will they?
tt0113086,Michael New,,6.8,2000,"Florentino is a young horseman and singer, a free spirit living in the open world without restrictions, in the Venezuelan plains. He confronts the devil in a duel of improvised verses. As time passes, these unspoilt plains start to change. Through Florentino's voice and actions, the plains cannot be conquered. Its culture defies the devil in the eternal fight between ... Leer todo"
tt0116748,Rakesh Roshan,"Sachin Bhowmick, Ravi Kapoor, Sagar Sarhadi",3.7,3h,"Wealthy Rajiv Sinha and middle-classed Amar Saxena are two childhood friends, with similar likes, and tastes. Their similar habits lead them to being in love with the same woman - Seema, who loves Amar, and is willing to marry him no matter what. Rajiv attempts to offer money to Sapna's guardian so that he can marry her, in vain though. When Rajiv attempts to convince... Leer todo"
tt0115874,Marcos Manhães Marins,Marcos Manhães Marins,,,Dirección
tt0116391,Mazhar Khan,,6.2,2h 47min,
tt0118694,Kar-Wai Wong,Kar-Wai Wong,8.1,1h 38min,
tt0118710,George Bazala,"George Bazala, Patrick Clarke",6.3,1h 36min,"A young Irishman enters the US illegally with his wayward friend Seamus. Landing in New York the pair start out with dreams of striking it rich but soon find themselves in dead-end jobs and drifting apart. As Seamus pursues various get-rich schemes, the more cautious Patrick finds himself devoting time to looking after Tom, an Irish author down on his luck, and courti... Leer todo"
tt0118852,Al Pacino,Ira Lewis,7.1,1h 39min,"Harry and Jake, two unsuccessful writers, spend a cathartic evening arguing about money, aesthetics, their friendship, and Harry's new manuscript."
tt0119866,Bruno Nuytten,Bruno Nuytten,5.4,1h 44min,"Faustine,now an adult ,wants to know all about her father's death;she learns he was once in love with a fifteen-year-old girl ,Alice ."
tt0119495,Adrian Fulle,"Adrian Fulle, David J. Miller, Daniel Bingley",5.0,1h 26min,"A group of raucous college buds living the Dorm life, decide to have a blowout while most of their friends are away for the Thanksgiving holiday. With LOVE 101 being the toughest course this semester, will they pass the final exam?"
tt0119966,Dorian Ramírez,Dorian Ramírez,6.6,1h 15min,Dirección
tt0120202,David Mamet,David Mamet,6.7,1h 45min,A movie crew invades a small town whose residents are all too ready to give up their values for showbiz glitz.
tt0120467,Bryan Johnson,Bryan Johnson,5.2,1h 27min,A man who performs as a children's birthday party clown tries to piece his life back together after being gang-raped.
tt0123003,"Shirley Mac, Laine",David Ciminello,6.0,1h 48min,
tt0122161,Kikuo Kawasaki,Kikuo Kawasaki,4.9,1h 39min,"The entangled stories around the life of Elsie Taryn Townsendz, who becomes rich from being a country town's girl."
tt0120117,N. Chandra,"N. Chandra, Rajeev Kaul, Praful Parekh",4.7,2h 40min,"Filled with vengeance, a simple man turns into a hardcore criminal in order to avenge the destruction of his family."
tt0120626,Maria de Medeiros,Maria de MedeirosÈve Deboise,7.1,2h 3min,
tt0120263,Roy Andersson,Roy Andersson,7.5,1h 38min,
tt0120753,Wim Wenders,"Nicholas Klein, Bono",5.7,2h 2min,
tt0120630,"Peter Lord, Nick Park","Peter Lord, Nick Park, Karey Kirkpatrick",7.1,1h 24min,
tt0120698,Keoni Waxman,Richard Beattie,4.4,1h 34min,"A dark, comedic thriller about fraud, bank robbers, and a search for love."
tt0122459,Bonnie Hunt,"Bonnie Hunt, Don Lake, Andrew Stern",6.9,1h 55min,A man who falls in love with the woman who received his wife's heart must decide which woman it is who holds his heart.
tt0127349,Keith Gordon,"Scott Spencer, Robert Dillon",6.4,1h 45min,"A congressional candidate questions his sanity after seeing the love of his life, presumed dead, suddenly emerge."
tt0130623,"Eric Leighton, Ralph Zondag","Thom Enriquez, John Harrison, Robert Nelson Jacobs",6.4,1h 22min,
tt0134630,Bruce Paltrow,John Byrum,6.1,1h 52min,"A professional karaoke hustler reconnects with his daughter and a bored suburban businessman turns outlaw karaoke singer, among other plotlines."
tt0133752,Ron Cosentino,Ron Cosentino,6.5,1h 40min,"Transplanted from New York, Duke and his brother Frankie Romano live in a rundown LA apartment with their alcoholic mother (Karen Black)."
tt0135707,Tom Shell,"Nicholas Wilson, Elizabeth Hansen",6.3,1h 37min,The 1854 Wyoming historical drama is based on Tom Shell's adaptation of the true life memoirs of Pony Express rider Nick Wilson.
tt0138353,Adrian Pasdar,Justin Monjo,5.7,1h 37min,"What's the bond between partners, between brothers, and between spouses? In L.A., Bill Holt handcuffs Sean Rickhart inside a rebar frame for a freeway pillar at a construction site; Bill's going to bury Sean in quick-drying cement. Guided by the narration of Nin, Bill's coke-snorting partner, we go back and forth over the past 48 hours to find out what brings Bill and... Leer todo"
tt0138927,Barry Berman,Barry Berman,6.5,1h 35min,A mother flees to her hometown after her son gets into trouble.
tt0138655,Ayanna Floyd,Ayanna Floyd,,,An unhappy country music disc jockey's life changes when she meets a man in a convenience store.
tt0138946,James Gray,"James Gray, Matt Reeves",6.4,1h 55min,
tt0138818,Douglas Green,Mitch Giannunzio,6.5,1h 37min,"A son visits his aging mother and sees tragic, intermittent signs of senility, but she pleads with him not to send her to a sanitarium."
tt0139500,Pedro Costa,,7.0,2h 51min,
tt0141399,Andrew Bergman,"Michael Korda, Paul Rudnick",5.3,1h 35min,"Bette Midler and Nathan Lane star in this comedy about Jacqueline Susann, the ambitious woman of dubious talent who wrote Valley of the Dolls, a best-selling novel that became a sensation."
tt0143344,Lorenzo Doumani,"Lorenzo Doumani, Mark Stevens",4.1,1h 39min,"Inspired by her father, a former boxer whose family duties superseded his athletic ambitions, a young woman (Sophia Adella Hernandez) decides to enter the sport."
tt0144142,Lisa Krueger,Lisa Krueger,5.1,1h 38min,A young woman goes in search of her midlife crisis suffering husband who left her.
tt0144084,Mary Harron,"Bret Easton Ellis, Mary Harron, Guinevere Turner",7.6,1h 42min,
tt0142155,Christopher Gotschall,,6.0,21min,"Jamie, an aspiring photographer and clumsy romantic, falls for his friend William, a pre-med student who's involved in a long-term relationship with an older man. Shared dance lessons and shared wine lead to shared beds. William wants Jamie but won't leave his partner. Confronting William and confronted by William's partner, Jamie begins to sort out the difference bet... Leer todo"
tt0144613,"Sebastián Lelio, Marialy Rivas","Sebastián Lelio, Marialy Rivas",,,"Technoculture and social restrictions, in Santiago de Chile, at the end of the millenium."
tt0146309,Roger Donaldson,"David Self, Ernest R. May, Philip D. Zelikow",7.3,2h 25min,
tt0146882,Stephen Frears,"Nick Hornby, D.V. De, Vincentis, Steve Pink",7.4,1h 53min,
tt0146984,Robert Redford,"Steven Pressfield, Jeremy Leven",6.7,2h 6min,
tt0148421,Martin Davidson,"Jeffrey Goldenberg, Robert Held, Martin Davidson",6.6,1h 37min,The lead singer of an oldies group reminisces about the good ol' days and a potential comeback.
tt0149624,Billy Bob Thornton,"Cormac Mc, Carthy, Ted Tally",5.8,1h 56min,
tt0149367,Marek Kanievska,"E. Max Frye, Topper Lilien, Carroll Cartwright",6.3,1h 29min,
tt0151150,Mansoor Khan,"Aatish Kapadia, Mansoor Khan, Nidhi Tuli",6.1,2h 42min,"Max, who lives with his twin sister Shirley in Goa, is enraged when he finds out that she has fallen in love with Rahul, his bitter rival Prakash's younger brother."
tt0153012,L.P. Brown IIIJohn Sjogren,L.P. Brown III,4.0,1h 24min,Jack (an ex P.I.) steals a briefcase from local mobsters. A stripper joins him on the run. Other local mob groups are also interested in the contents of the briefcase.
tt0153100,Francis Delia,"Francis Delia, Norman Mailer",7.2,1h 33min,"A thirty-something Irish-American former matador teaches a bull-fighting class in Greenwich Village. After the sexual conquest of a number of his female students, he meets his match in a 19-year-old co-ed."
tt0153464,Philip Haas,"W. Somerset Maugham, Belinda Haas",6.0,1h 55min,"A widow finds choosing a new husband might not be her choice at all, as the actions of her various prospects confine her freedom."
tt0155723,Katherine Dieckmann,"Katherine Dieckmann, Leon Rooke",6.8,1h 27min,"A young loner wandering the back roads of North Carolina comes across an abandoned baby. He immediately starts seeking the baby's parents, but starts developing a bond with the child that explores his own isolated roots."
tt0155754,Bob Clark,Mark Sanderson,6.3,1h 30min,
tt0155150,Adele Bertei,James Campbell,4.8,1h 39min,"After a rich woman dies, her friends and relatives meet at her mansion to await the reading of her will. Over the evening, many of them hook up and have a passionate night together, including the maid. But someone's watching them."
tt0157202,Glenn Klinker,Glenn Klinker,4.8,1h 30min,"A deranged street person has flashes of sanity, and his outrage at, and disgust for, the nightly news body count inspires him to vanquish not only his inner demons, but also the very real ones that are preying, unchecked upon the innocent."
tt0156841,John Schlesinger,Tom Ropelewski,4.7,1h 48min,
tt0156942,Ron Krauss,"Oona Croese, Ron Krauss, Mario Zavala",5.4,1h 25min,Kids go to a rave and not all of them make it home the next day.
tt0156812,Jay Russell,"Willie Morris, Gail Gilchriest",7.0,1h 35min,
tt0156757,John Forte,John Forte,5.9,1h 32min,A Catholic high-school student trying to perfect his soccer timing by practicing dance falls in love with his dance partner.
tt0157122,Liv Ullmann,Ingmar Bergman,7.4,2h 34min,
tt0158033,Pat Murphy,"Brenda Maddox, Pat Murphy, Gerard Stembridge",5.9,1h 46min,"Dublin, 1904, James Joyce chats up Nora Barnacle, a hotel maid recently come from Galway. She enchants him with her frank, uninhibited manner, and before long, he's convinced her to come with him to Trieste."
tt0159371,Christopher Robin Hood,Christopher Robin Hood,7.3,1h 30min,"Rob's successful life is interrupted when he crosses paths with smart beautiful Leslie. After being suddenly and mistakenly arrested, Rob begins a city-wide search for the woman of his dreams unsure of her last name or where to find her."
tt0158871,Aage Rais-Nordentoft,"Jens Dahl, Aage Rais-Nordentoft",5.5,1h 33min,"A Sergeant in the UN peacekeeping force in Bosnia charges money to take some gun toting civilians on a guided tour to shoot some real Serbs 'for the excitement of it'. Fatal events unfold, revealing the starkness of war and armed strife."
tt0160495,Paul Nicholas,Brendan Beseth,4.7,1h 41min,"Kirsten Dunst plays a young woman (Lidda), who is searching for her father (James Caan). She finds herself at odds with her boyfriend who wants nothing but a carefree lifestyle."
tt0160547,Michael Browning,Michael Browning,4.9,1h 32min,"A series of mishaps and misfortunes over $1 million in cash leads to murder, mayhem and greed."
tt0160550,Aleksandr Zeldovich,"Vladimir Sorokin, Aleksandr Zeldovich",6.3,2h 19min,"The film centres on Mike, a businessman in decidedly the new Russian mould. When Mike gets stung on a deal, his suspicions immediately fall on Lev, who receives the customary torture to make him reveal where the money has gone."
tt0160663,Martin Schenk,Martin Schenk,5.5,1h 28min,Four teenagers pull a prank that goes awry.
tt0160644,Alain Berliner,"Ron Bass, David Field",5.5,1h 45min,A psychological romantic thriller where fantasy and reality become indistinguishable for a woman leading a double life in her dreams.
tt0160289,Paul Rachman,"Shawn David Thompson, William Quist",5.5,1h 37min,"Four friends steal a valuable statuette for a dangerous black market art dealer, lose it, and are forced to play a deadly bluffing game to save their lives."
tt0159784,Joe Chappelle,"Tsutomu Shimomura, John Markoff, David Newman",6.2,1h 32min,
tt0161216,Robert Greenwald,"Anita Hoffman, Abbie Hoffman, Marty Jezer",6.4,1h 46min,
tt0160759,António Ferreira,António Ferreira,6.6,45min,"What stops two people from being together? A third one. What stops one person from fighting for another? Nothing. Pedro lives in the suburbs, where he works with his father in a garage. Everyday he takes the bus downtown where he goes to school and meets his friends. It's summertime and they all go down to the river where they spend their free time or even their schoo... Leer todo"
tt0160484,Janusz Kaminski,"Pierce Gardner, Betsy Stahl",4.8,1h 37min,
tt0160797,William Friedkin,"Jim Webb, Stephen Gaghan",6.4,2h 8min,
tt0160749,Tag Purvis,Tag Purvis,6.1,1h 50min,"Red Dirt offers the story of a young man's search to belong in this sublime expression of love and reconciliation. At only twenty, Griffith is struggling with the responsibilities of caring for his unwell aunt, grieving the loss of their family's matriarch, and his own dreams of leaving Pine Apple. With the arrival of a stranger, Griffith's carefully constructed walls... Leer todo"
tt0161003,Rel Dowdell,Rel Dowdell,5.1,1h 33min,What started out as an innocent night of fun and games with upperclassmen and younger freshman college women turns into lies betrayal and an ultimate journey on the train ride
tt0160616,"Dan Mc, Cormack","Dan Mc, Cormack",5.7,1h 44min,"This stylized turn-of-the-millennium thriller follows troubled couple Phil and Anna, each suspecting the other of infidelity, as they try to keep their paranoia and distrust from further fracturing the strange world around them."
tt0162222,Robert Zemeckis,William Broyles Jr.,7.8,2h 23min,
tt0161081,Robert Zemeckis,"Clark Gregg, Sarah Kernochan",6.6,2h 10min,
tt0162983,Diane Keaton,"Delia Ephron, Nora Ephron",4.8,1h 34min,
tt0163125,Jon Dichter,Jon Dichter,5.3,1h 42min,"A telephone operator takes revenge an a rude customer by ruining his credit rating, his reputation, and his marriage."
tt0162901,Mariano Barroso,"Mariano Barroso, Luis Marías, Joaquín Notario",5.8,1h 35min,
tt0164182,Stephen Erickson,Stephen Erickson,8.3,1h 35min,"A heart-hardened son returns home to keep a promise to his dying father, a master stonecutter. This story touches a universal chord as it explores the passing on of an artistic legacy in spite of the dark shadows of an unresolved past."
tt0164212,Stephen Hopkins,"John Wainwright, Claude Miller, Jean Herman",6.4,1h 50min,
tt0163983,Chuck Russell,"Cathy Cash Spellman, Thomas Rickman, Clifford Green",5.1,1h 47min,
tt0163676,Mary Lambert,"Mark Gibson, Philip Halprin",4.6,1h 45min,"A mentally disturbed young woman takes a job at a posh country club and falls in with a clique of wealthy college kids where she's taken under the wing of the clique's twisted leader, who harbors some dark secrets too terrifying to tell."
tt0163978,Danny Boyle,"John Hodge, Alex Garland",6.6,1h 59min,
tt0163745,Gene Cajayon,"Gene Cajayon, John Manal Castro",6.4,1h 34min,A young man struggles with his desire to study art when his family thinks he's headed for premedical studies. Conflicts between Filipino traditions and expectations vs. personal dreams in the contemporary world erupt at his sister's debut.
tt0164318,Martin Spottl,"Sigal Erez, Martin Spottl",5.5,1h 39min,A small-town sheriff falls in love with a Latina illegal immigrant who witnessed a murder on the Texas border.
tt0164545,William R. Greenblatt,Andrew Stein,3.7,1h 29min,"After his wife is killed researching a deadly virus, a doctor, out of anger and guilt, infects himself with the virus and threatens the world."
tt0165642,Rafael Eisenman,"Zalman King, Elise D'Haene",3.2,1h 25min,"Gabe, a photographer, his assistant, Annie, and his boss hire a ship to take them out to sea on a modeling shoot. What Gabe doesn't know is that an old friend-turned-enemy of his has indirectly lured him into the situation, and the models that were hired locally are skilled weapons handlers and dealers. The ship is on its way to meet a South African submarine to whom ... Leer todo"
tt0166013,John Mackenzie,"Guy Andrews, Ronan Gallagher, Colum Mc, Cann",6.4,1h 47min,"Irish crime-investigating reporter Sinead Hamilton invades the Irish underworld and attempts to expose the illegitimate activities that she has found. Hampered by the system, a police consort is ineffectual at aiding her despite trying to step outside of the normal bounds. Her husband, who hates her activities and the danger she places herself in, grudgingly admires h... Leer todo"
tt0165800,Cameron Thor,"Tiffany Salerno, Tim Puntillo",3.9,1h 29min,"Nine former schoolmates are invited to a cabin for a reunion, but their hostess commits suicide. They all try to figure out why."
tt0167183,Irene Turner,Amanda L. Beall,4.8,1h 41min,Grace and her roommate Casey don't get along. Grace is in a happy relationship with Charlie and they are planning to get married soon and that frustrated Casey because she thinks Grace just has everything. As the time goes by their relationships will get more complicated and nothing will be as it seemed...
tt0168446,Hans Petter Moland,"Hans Petter Moland, Kristin Amundsen, Lars Bill Lundholm",7.1,1h 53min,"A mom dying in Aberdeen, Scotland, asks her coke snorting, nympho, London lawyer daughter to get her estranged, alcoholic dad in Oslo, Norway, to Aberdeen. He's drunk at the airport, so they travel together by car and ferry."
tt0168629,Lars von Trier,"Lars von Trier, Sjón",7.9,2h 20min,
tt0168509,Gabriel Auer,Gabriel Auer,6.2,1h 24min,Dirección
tt0167203,Hugh Hudson,"Kuki Gallmann, Paula Milne, Susan Shilliday",5.5,1h 54min,
tt0167380,Aleksandr Proshkin,"Alexander Pushkin, Galina Arbuzova, Stanislav Govorukhin",6.6,2h 10min,A historical drama based on the novel of the same name.
tt0169324,Kevin Tenney,Kevin Tenney,5.6,1h 35min,
tt0168612,Greg Morgan,Robert David Cochrane,5.3,1h 37min,"A gritty tale of how the game of life plays out in Inglewood, California. When a pickup basketball game turns deadly, Reggie seeks revenge as he tracks down his best friend's killers. When Reggie locates who he believes are the perpetrators, everyone around wants to ensure the matter is handled fairly and without any additional bloodshed."
tt0169122,Jag Mundhra,"Thomas A. Fucci, Randor Guy",3.5,1h 35min,
tt0168856,"Stefan Fjeldmark, Greg Manwaring, Michael Donovan","Tracy J. Brown, Stefan Fjeldmark, Karsten Kiilerich",6.0,1h 20min,"Three children accidentally get turned into fish after drinking a potion made by an eccentric scientist. When the kids end up in the sea, they must find the antidote within 48 hours or remain as fish forever."
tt0168504,Scott Wiper,Scott Wiper,5.6,1h 41min,A Chicago cop quits the force and finds himself threatened by the Mafia.
tt0168631,Gregory Marquette,Gregory Marquette,4.7,1h 30min,
tt0171433,Edward Norton,Stuart Blumberg,6.4,2h 8min,
tt0171359,Michael Almereyda,"William Shakespeare, Michael Almereyda",5.9,1h 52min,Modern-day New York City adaptation of Shakespeare's immortal story about Hamlet's plight to avenge his father's murder.
tt0170452,John Leekley,"John Leekley, Evan Rhodes",5.1,1h 49min,"A young boy sets out to find his mother. After setting up camp in Central Park, he encounters a group of people even needier than himself."
tt0170691,Joel Schumacher,"Ross Klavan, Michael Mc, Gruther",6.9,1h 41min,
tt0172495,Ridley Scott,"David Franzoni, John Logan, William Nicholson",8.5,2h 35min,
tt0171580,"Neil La, Bute","John C. Richards, James Flamberg",6.3,1h 50min,
tt0172699,Tracy Alexson,Tracy Alexson,4.6,1h 30min,"Sarah and Ryan were a great couple. They had their fun together, but the man's fear of commitment pushed the woman away. Yet the situation between them isn't over because Sarah is pregnant and she's trying to find ways to hide this news from Ryan and everyone else - except her best friend, who probably won't be of much help in this matter."
tt0172632,Stanley Tucci,"Joseph Mitchell, Howard A. Rodman",6.6,1h 44min,"Around 1940, The New Yorker staff writer Joe Mitchell meets Joe Gould, a Greenwich Village character, who is writing a voluminous Oral History of the World, a record of twenty thousand conversations he's overheard."
tt0173999,Tony Barbieri,Tony Barbieri,6.3,1h 40min,"A 10-year-old boy shares an intense bond with his mentally ill mother. The youth's life is turned upside down when his mother lapses into violent psychosis. A former psychiatrist takes pity on, and then custody of, the child."
tt0174027,Mohamed Rachid Benhadj,Mohamed Rachid Benhadj,6.4,1h 47min,
tt0174480,Joan Chen,Allison Burnett,5.6,1h 43min,
tt0174646,Gil Brenton,Gil Brenton,6.5,1h 19min,A beautiful woman comes between a father and son.
tt0176578,"Jimmy Bridges, Todd Bridges","Jimmy Bridges, Todd Bridges",6.9,45min,"A short film about the rise, fall and rise of child star Todd Bridges (Arnold (1978))."
tt0176783,Davis Guggenheim,"Gregory Poirier, Theresa Rebeck",5.9,1h 30min,
tt0177195,Clinton Smith,"Clinton Smith, Peter Buckmaster, Anthony O'Connor",4.1,1h 37min,"This edgy Australian film stars an ensemble cast headed up by pop superstar Kylie Minogue, David Field, and Simon Lyndon. Various characters interact under strange circumstances, calling to mind movies such as GO and PULP FICTION."
tt0177971,Wolfgang Petersen,"Sebastian Junger, William D. Wittliff",6.5,2h 10min,
tt0177888,Seth Zvi Rosenfeld,Seth Zvi Rosenfeld,5.9,1h 39min,"Seymour's happy New York existence comes to a tragic end after he witnesses the murder of his mother, a renowned civil rights activist. When he finds a firearm in the home of his best friend, he embarks on a deranged quest for revenge."
tt0179137,Silvio Caiozzi,"Silvio Caiozzi, José Donoso",7.1,2h 20min,A lonely man becomes increasingly obsessed with the beautiful teenager he used to help care for his grandmother.
tt0177068,Laurence Fishburne,Laurence Fishburne,5.2,1h 47min,"Street hustler Mike cooks up a drug rip-off with his estranged half-brother Torch. Simple robbery turns fatal bloodbath, so they hide out in a claustrophobic rat hole waiting for Mike's buddy Tony, who's ""out of the life,"" or so he says."
tt0178050,Adam Collis,"Randall Jahnson, Russell De, Grazier",5.6,1h 30min,"A comedy that takes place over twenty-four hours on the Sunset Strip, in 1972."
tt0179473,Dwight Yoakam,"Dwight Yoakam, Dennis Hackin, Otto Felix",4.1,2h 11min,"A U.S. Marshal tracks a destructive clan of outlaws, while a government man claims that the Marshal is actually a ghost of his deceased self."
tt0179861,David Giancola,David Giancola,3.6,1h 30min,At the the Killington ski resort something has gone awry. Evil terrorists led by the sinister Greig have taken the resort hostage with a stolen nuclear device. It's up to Ski Patrol bum Matt Foster to save the day... and his fiancé.
tt0179443,Edward Thomas,James Hawes,3.5,1h 31min,Pete in London inherits a company. The ambitious accountant makes a deal with a Russian mafia boss. The Russian wants hard currency and grand-kids but kills his daughter's lovers. His daughter needs an Englishman like Sir Francis Drake.
tt0180093,Darren Aronofsky,Hubert Selby Jr.Darren Aronofsky,8.3,1h 42min,
tt0180073,Philip Kaufman,Doug Wright,7.2,2h 4min,
tt0179653,Nick Efteriades,Nick Efteriades,7.1,1h 43min,"In Queens, NY, aka ""Little Athens,"" a blue-collar Greek-American family struggle to hold on to the American Dream. Follow the journey of 28-year-old Alex and his desire to escape his urban hometown to pursue an off-beat dream."
tt0181311,"Mary Mc, Guckian","John Lynch, Mary Mc, Guckian",5.6,1h 42min,
tt0181819,Richard Hobert,Richard Hobert,5.7,1h 54min,"Mikael turns 50 and celebrates big time, inviting all his friends to a gigantic party. He has a secret he intends to announce during the party."
tt0180837,Bruno Barreto,"Alexandre Machado, Sérgio Sant'Anna, Fernanda Young",6.3,1h 35min,A separated attorney in Rio sees an English teaching American widow and tries to woo her.
tt0181865,Steven Soderbergh,"Simon Moore, Stephen Gaghan",7.6,2h 27min,
tt0181945,John D. Hancock,Dorothy Tristan,5.5,1h 46min,
tt0183056,Arnaud Desplechin,"Arnaud Desplechin, Emmanuel Bourdieu, Arthur Symons",6.8,2h 37min,"A Jewish girl in nineteenth century London, dreams of becoming a stage actress."
tt0183280,John Putch,James Morley IIIKeoni Waxman,3.3,1h 30min,"When a tsunami created by a nuclear explosion capsizes a cruise ship, a special agent must help the surviving passengers reach the surface when it becomes apparent that there's a group of terrorists on board."
tt0183639,C. Grant Mitchell,"David A. Goodman, Daniel Riordan, Robert Louis Stevenson",4.5,1h 34min,The story of Frank Cassilis and Northmour as both seemingly try to protect the Huddlestone family against mexican separatists while each has their own purposes and agenda.
tt0183659,Ed Harris,"Steven Naifeh, Gregory White Smith, Barbara Turner",7.0,2h 2min,
tt0180683,Matthew Miele,"Chris Fetchko, Matthew Miele",5.9,1h 32min,A homeless man takes a newly homeless man under his wing and teaches him how to survive on the streets.
tt0181536,Gus Van Sant,Mike Rich,7.3,2h 16min,
tt0183550,Mark Lamprell,Mark Lamprell,6.4,1h 35min,"When a meddlesome mother enrolls in university with her son, old and new worlds collide with awesome consequences."
tt0183423,Kennedy Goldsby,Kennedy Goldsby,3.8,1h 29min,"Four friends all going a painful breakup, know too much about each other, and the hostility they've been expressing gets turned toward each other."
