0,1,2,3,4,5
tt0248110,Pat Bermel,"Pat Bermel, Neil Bermel",4.3,1h 25min,"Six people are invited to a remote island by a famous horror author for dinner. He reveals that he poisoned everyone, just as he was having his own epiphany. In order to get the antidote, each person must confess their lies."
tt0249498,Tom Logan,"Robert Adamski, Tom Logan",4.9,1h 37min,A defector from the Cuban military returns to his homeland to rescue his daughter who was left behind.
tt0250638,Johnnie To,"Nai-Hoi Yau, Kin-Yee Au",7.0,1h 28min,"When an obnoxious detective loses his gun to four young thugs, it's up to the P.T.U. (Police Tactical Unit) and their iron-willed leader to recover the weapon and clean up the mess before daybreak."
tt0249846,Azazel Jacobs,"Azazel Jacobs, Curtis Winter",5.5,1h 36min,"Nobody Needs to Know is a story of Fame and the towns and industries and the people who create it and support it. It's the story of two actresses on divergent paths who unwittingly illustrate the power of Fame and its ability to pursue those who run from it and run from those who pursue it. Aesthetically. it's an alchemy of Nathaniel West's The Day of the Locust, The ... Leer todo"
tt0251677,Juan Gerard,"Letvia Arza-Goderich, Juan Gerard",5.8,1h 49min,"The year is 1958, and in Holguín, Cuba, a boy's world is about to change forever."
tt0252052,Jim Fitzpatrick,Jim Fitzpatrick,7.7,1h 33min,"The reality of life slams into the proverbial wall when a group of necessitous best friends and ex-lovers are reunited at a milestone reunion, igniting an already passionate and combustible past."
tt0254481,Rakesh Roshan,"Rakesh Roshan, Honey Irani, Sachin Bhowmick",7.1,2h 51min,"A developmentally disabled young man tries to continue the work his father did in communicating with extra-terrestrials from outer space, which leads to something miraculous and wonderful."
tt0255655,Thomas Halikias,Thomas Halikias,5.6,1h 31min,An up-and-coming trader must choose between the seduction of Wall Street and a return home to the woman and family he loves.
tt0256716,Franck Saint-Cast,"Thomas Benet, Franck Saint-Cast",4.8,32min,Dirección
tt0256400,Jalal Merhi,Glen G. Doyle,5.2,1h 31min,Two rival gangs battle for territory.
tt0260878,Leon Herbert,"Leon Herbert, Matthew Hope",4.9,1h 33min,"John thinks life is just perfect. He's in what he considers a solid relationship with girlfriend Mary and his job as a tailor suits him down to the ground. To put the icing on the cake he's about to ask Mary to marry him over the dinner which John has cooked especially. With the ring ready for Mary's hand, John is unprepared for Mary announcing that she's leaving him ... Leer todo"
tt0261992,Marni Banack,Mark Botvinick,5.0,1h 32min,Four post-college men living in Aspen try to figure out what to do with their lives.
tt0264108,Gary Boulton-Brown,Gary Boulton-Brown,4.7,1h 22min,"In a remote Arctic research station, government agents Brach (Stephen Moyer) and Schiller (Lucy Akhurst) discover the mysterious genetic scientist Dr. Clerval (Tom McCamus). A psychological chess game ensues. It turns out that Schiller was a subject in one of Clerval's genetic breeding programs, and was co-dependent of him. Brach once was Clerval's henchman. He feels ... Leer todo"
tt0263265,Alec Baldwin,"Stephen Vincent Benet, Archibald Macleish, Peter Dexter",5.4,1h 46min,A down-and-out writer sells his soul to the Devil in exchange for fame and fortune.
tt0263757,Boaz Yakin,"Julie Margaret Hogben, Mo Ogrodnik, Lisa Davidowitz",6.2,1h 32min,
tt0264395,"John Mc, Tiernan",James Vanderbilt,6.4,1h 38min,
tt0264946,Luis Alberto Restrepo,"Alberto Quiroga, Luis Alberto Restrepo",7.0,1h 34min,"A couple of farmers have been displaced from their land, a jungle area, isolated from the world, where lived his childhood and youth, and was brutally thrown to face the streets of an unfamiliar city, huge and ruthless."
tt0266697,Quentin Tarantino,"Quentin Tarantino, Uma Thurman",8.2,1h 51min,
tt0266465,F. Gary Gray,"Christian Gudegast, Paul T. Scheuring",6.0,1h 49min,
tt0265148,Sooraj R. Barjatya,Sooraj R. Barjatya,3.8,3h 17min,"This is the story of Sanjana, a girl of today's generation full of life and vibrant ecstasy. She lives life on her own terms and gets very upset when her mother Susheela, arranges for her to see a boy leading to a marriage prospect."
tt0267764,"Yuri Rutman, John Stecenko",Alexander Cicak,5.6,1h 35min,"Tragic story of a writer afraid of success. Too rough for polite society, he knows he'll never be able to squash his own ego and write something trite and unoriginal that will get him published."
tt0269347,William Friedkin,"David Griffiths, Peter Griffiths, Art Monterastelli",6.1,1h 34min,
tt0270349,Juan Carlos Buitron,Juan Carlos Buitron,6.7,1h 24min,A young man trades his hopes and dreams to save his brother from a life of drug-dealing and gang activity.
tt0271136,John Mackenzie,"Desmond Lowden, Timothy Prager",5.2,1h 35min,
tt0271445,Mark Locke,Mark Locke,5.6,2003,"A pub owner purchases a giant shrimp that has washed up on the English shore, teaches it to box, and hits the road in search of fame and fortune."
tt0271234,Sarah Rogacki,Cyn Canel Rossi,6.7,1h 23min,"Tough 15-year-old Rena, terrorized by her stepfather, turns to Santeria-practicing Wanda Love for help. But Rena's boyfriend and his friends have come up with their own way to teach her father a lesson."
tt0271337,Coline Serreau,Coline Serreau,4.6,1h 30min,"Marie (and her three fathers) are taking A-levels. Marie passes. She spends the summer in the country with her mother Sylvia, who has returned from America with her Californian husband who has two sons. Marie falls in and out of love for the first time in front of her alarmed fathers, who see Marie's innocence slipping away at frightening speed, and their relationship... Leer todo"
tt0272092,Vincente Stasolla,Vincente Stasolla,6.6,2003,The Forgotten tells the story of an American Corporal's last days while left to command his isolated front line tank unit during the Korean War.
tt0273689,Thomas Vinterberg,"Mogens Rukov, Thomas Vinterberg",5.3,1h 46min,
tt0274193,Francisco Athié,Francisco Athié,5.9,1h 26min,The story of an android that raises alive in the deepest caves of the mayan zone in México and meets and old dying man. They will stablish a spiritual bond than enlightens the old mayan and helps him to release himself out of his withered body.
tt0276053,Merlin Ward,Merlin Ward,4.5,1h 30min,"18-year-old Louise is stuck in a run-down girls' boarding school in the heart of the English countryside. Her only consolation, during the long cold nights, is Matthew, the American art teacher and second husband of the headmistress, Veronica Van Huet. Trouble is, half term is looming and Louise cannot bear the thought of being away from her lover for a whole week. So... Leer todo"
tt0276919,Lars von Trier,Lars von Trier,8.0,2h 58min,
tt0278293,José Luis García Agraz,Carlos Cuarón,5.6,1h 32min,"A Man inherits a boat, and then he embarks on the quest for an old spanish shipwreck."
tt0277585,Nevil Dwek,Nevil Dwek,5.7,1h 48min,"This psychological dramatic thriller set in New York City is about one man on a journey to find himself. Derrick, a 27-year-old corporate lawyer with a large trust fund, enters the polar opposite world of Zane, a hapless criminal and an aspiring musician. Although the two have never met, and never will, the lives of Derrick and Zane are more connected than either one ... Leer todo"
tt0277171,Bill Fishman,Howard Kaylan,6.3,1h 30min,"The Turtles, a California rock band, tours England for the first time, meeting Frank Zappa, the Beatles and Jimi Hendrix."
tt0279111,Ron Maxwell,"Jeff Shaara, Ron Maxwell",6.2,3h 39min,
tt0282413,Rebecca Bagley-Cook,Rebecca Bagley-Cook,5.5,1h 41min,"One night in a small town in North Carolina, fate brings together three lives: an entertainment lawyer returning home to his dying mother after years in escape of his past, a woman trying to reclaim her supposed love, and a boy with a penchant for the sixth sense who struggles with the death of his father and overbearing love of his single mother. When the past and fu... Leer todo"
tt0282551,Henry Barrial,Eva Fisher,7.1,2003,"The relationship between a young man (Daniel) and his sister (Ally). Their mother dies and Daniel comes to live with Ally. Not understanding all the responsibilities which comes along with Daniel, Ally takes on the role as his protector from not just harm but from life. See Daniel has Downs Syndrome, Daniel lives a regular life. Ally doesn't see this until one day she... Leer todo"
tt0283096,Sean Walsh,James Joyce,5.5,1h 53min,"Adapted from James Joyce's Ulysses, Bloom is the enthralling story of June 16th, 1904 and a gateway into the consiousness of its three main characters: Stephen Dedalus, Molly Bloom and the extraordinary Leopold Bloom."
tt0281811,Yossi Wein,"Michael D. Weiss, Danny Lerner, Boaz Davidson",2.5,1h 30min,
tt0282715,Jorge Echeverry,,5.1,1h 32min,"Chosen by the critics as one of the best Colombian films ever its emotional intensity is both sensual and tragic. Set in the Sierra Nevada, an adolescent falls in love with her mother's heroine-addict lover. Wonderfully acted.;Elegida por la critica como uno de los mejores films colombianos, su intensidad emocional es sensual y tragica. En la Sierra Nevada, una adoles... Leer todo"
tt0281994,Claire Devers,"Claire Devers, Jean-Pol Fargeau, Jean-Claude Izzo",5.3,1h 47min,"Based on a novel by Jean-Claude Izzo, this melancholic movie focuses on three sailors being the last remaining crew members on their ship which is aground in the harbor of Marseille. After the owner has sold the ""Aldébaran"", only the Lebanese captain Aziz, the Greek Diamantis and the Turk Nelim are stuck on the boat for a lack of prospects. Aziz doesn't want to return... Leer todo"
tt0283249,Matteo Petrucci,Matteo Petrucci,6.2,1h 59min,"A brother and sister, have lost their mother and are united by a relationship bordering on incest. They meet a boy whose strong charm actually hides a sick personality, but he immediately seems to have a certain influence on the girl."
tt0283453,Peter Masterson,Jeff Cole,5.5,1h 35min,A hitchhiker's life changes when he meets a seductive woman who lures him into the body of her husband.
tt0282543,Mike Bencivenga,"Richard Levine, Mike Bencivenga",6.2,1h 33min,"Tulley, a once-promising literary star now biding his time as an advertising copy editor, moves from cynicism to acceptance as he secretly hopes to write a great novel only to learn that his life of booze will end all too soon."
tt0283552,Juan Carlos Desanzo,"Juan Carlos Desanzo, Lito Espinosa",6.8,1h 32min,A teenage street urchin tries to save his new love from prostitution.
tt0283329,Mikael Colville-Andersen,Mikael Colville-Andersen,5.6,1h 15min,A portrait of a generation. Choosing love over oneself has never been this difficult...
tt0282891,Matia Karrell,"Matia Karrell, C.W. Cressler",6.4,1h 45min,A dying man must reunite with his sister to face their family's violent past and find peace in their lives.
tt0284426,Chris Boebel,"Charles E. Boebel, Chris Boebel",7.1,1h 38min,"A close-knit Midwestern farm family deals with loss, change, and social progress during the 1940's."
tt0284974,Kilian Kerwin,Kilian Kerwin,5.1,2003,"Brad, an art student hoping to win a prestigious fellowship, finds his life and career turned upside down when he falls for a faculty member at his college, Lisa Ducharme, who just happens to be his girlfriend's thesis adviser..."
tt0285052,Jean Becker,"Jean Becker, Jean Cosmos, Guillaume Laurant",7.0,1h 35min,France under occupation by the Germans during WW2: Two men inspired by a free France radio broadcast perpetrate an act of sabotage with unwitting consequences for them and their fellow villagers.
tt0285531,Lawrence Kasdan,"Stephen King, William Goldman, Lawrence Kasdan",5.5,2h 16min,
tt0285534,Peter Spirer,Michael Andrews,6.1,1h 29min,An investigator from the state attorney general's office is sent to a small Southern town to investigate a strange murder.
tt0288861,Pieter Kuijpers,"Pieter Kuijpers, Paul Jan Nelissen",7.1,1h 23min,"Two small-town Dutch boys have such a close socially unnatural friendship that they care nothing for human or divine rules and lose all grip on reality, sliding into violent crime."
tt0285475,Ana Clavell,Jason Rainwater,3.9,1h 28min,Sophia is a street fighter who is going to show the boys in East L.A. what it means to fight as a girl.
tt0286788,Dennie Gordon,"William Douglas-Home, Jenny Bicks, Elizabeth Chandler",5.8,1h 45min,
tt0286244,Sylvain Chomet,Sylvain Chomet,7.7,1h 20min,
tt0285861,Richard Kwietniowski,"Gary Stephen Ross, Maurice Chauvet",7.0,1h 44min,A bank manager with: (a) a gambling problem and (b) access to a multimillion dollar account gets into a messy situation. Based on the story of the largest one-man bank fraud in Canadian history.
tt0285727,Allan Mindel,Richard Murphy,6.1,1h 35min,"A young man who's been labeled mentally ill is left on his own after his mother's murder. Confused and alone, he's targeted by two different con artists out to make off with his inheritance."
tt0286708,"Steve Di, Marco","Steve Di, Marco, James Tichenor",7.7,2003,"One night at a party, three teenagers start a friendship that becomes the most important of their lives. As the they grow closer to each other, we begin to see the root of each of their hurts. Stevie's father refuses to deal with the suicide of Stevie's mother and ignores Stevie's need to deal with it. Darla is forced to deal with surviving on her own after her mother... Leer todo"
tt0287624,Mario Andreacchio,"Mario Andreacchio, John Goldsmith",5.7,1h 33min,A successful 19th century French stockbroker (Sutherland) leaves his profession to become an artist in Paris.
tt0289176,Andrew Molina,Eishy Hayata,7.3,1h 30min,This is the true story of the rise of a Japanese businessman from Los Angeles named Eishy Hayata from an Airline engineer into the legend of the Emerald world -- the Emerald Cowboy. He moved to Columbia in the 70's and with six guns at his side fought his way to the top by 2000.
tt0287669,Bryan Goldsworthy,Wendy English,6.1,1h 25min,"Life in the small town of Beaumont, Texas is more complex than it would seem."
tt0288330,Ondrej Trojan,Kveta LegátováPetr Jarchovský,7.5,2h 30min,"A nurse is part of the resistance in 1940s Czech Republic. She is discovered and must find a place to hide. A patient whose life she saved, from a remote mountain village where time stopped 150 years ago, agrees to hide her as his wife."
tt0289635,David Mackenzie,"Alexander Trocchi, David Mackenzie",6.3,1h 38min,
tt0289889,Marleen Gorris,Katherine Fugate,6.1,1h 36min,A young woman escapes her wildly eccentric family in search for a life of normalcy.
tt0289992,Alan Parker,Charles Randolph,7.5,2h 10min,
tt0292527,Bala Rajasekharuni,Bala Rajasekharuni,5.7,1h 40min,"Green Card Fever is the story of a young man in the United States who overstays his visa in the pursuit of a ""Green Card"". He naively muddles through an underworld of illegal immigrants, immigration lawyers and the INS, and the love of an American girl of Indian origin."
tt0291121,Dale G. Bradley,"Rebecca Goldsmith, Rebecca Goldsmith, Lynne Moses",4.6,1h 30min,"With Matt seeming to straying into the hands of every pretty girl, where could the family end up? Standard murder and mayhem thriller with good production and technical values."
tt0290555,Dominic Shiach,"Colin D. Simpson, Brad Simpson, Wilson Coneybeare",3.8,1h 25min,"A lawyer investigates the puzzling suicide of her twin sister, discovering her sister's involvement with kinky sex and a mysterious lover"
tt0293495,Egidio Eronico,"Egidio Eronico, Antonella Grassi, Fabio Carpi",6.5,1h 40min,"A man who grew up an orphan finally gets to meet his father: The psychopath Dr. Josef Mengele, the Auschwitz surgeon who performed genetic experiments on concentration camp refugees during WWII."
tt0290862,Issa Traoré de Brahima,Issa Traoré de Brahima,,,The film centers on the plan of a government minister to build a road through a sacred forest and the local community's resistance to this project.
tt0292496,John Curry,,6.8,2003,Dirección
tt0291561,"Kurt Inderbitzin, Gay Walch","Kurt Inderbitzin, Gay Walch",6.8,1h 29min,Dirección
tt0291542,Martin Provost,"Marc Abdelnour, Philippe Lasry, Martin Provost",6.6,1h 32min,"The 20-year-old Juliette tries to come to terms with an unexpected pregnancy, despite a lack of support from the father of the child and from her mother."
tt0293007,Hector Babenco,"Hector Babenco, Fernando Bonassi, Victor Navas",7.6,2h 25min,
tt0294595,Namron,"Hariry Jalil, Namron, William Shakespeare",5.6,1h 5min,"Set in the underground music scene, this loose adaptation of ""Julius Caesar"", with Caesar as a skinhead and Brutus as an undercover cop, is about the power struggle between two men."
tt0294357,Martin Campbell,Caspian Tredwell-Owen,6.4,2h 7min,
tt0294606,Edoardo Ballerini,"Edoardo Ballerini, H.L. Mencken, John Rothman",7.3,15min,Dramatization of an H.L. Mencken story. Rudolph Valentino comes to Menckin's hotel room to seek advice about how to deal with a newspaper editorial that claims Valentino's screen career has emasculated the American male.
tt0293672,Bertrand Blier,Bertrand Blier,5.1,1h 26min,"A father arrives at his son's house one evening. They begin talking about women, love, relationships and things turn awkward fast."
tt0295565,Ersi Danou,Ersi Danou,6.2,1h 30min,Dirección
tt0295182,Bill Carleton,"Bill Carleton, Amy Chilcote",4.3,1h 27min,"Alex Starbuck has it all... a high paying job, a beautiful home, and a wardrobe that any woman would die for. But there's a glitch in her portable, hard-driven life. While her job is stressful, the only physical release she receives from her hi-tech husband Mark are numerous emails. Things become hilariously complicated when Alex has a romantic encounter with Graeme, ... Leer todo"
tt0296618,Lionel Epp,"Lionel Epp, Laurent Thoraval",4.6,1h 37min,"Jean-Claude, a bent night-club owner, on his way escaping to Mexico, unfortunately had an accident with a young couple on a motorcycle. But Cédric has witnessed the accident...."
tt0298131,Margarethe von Trotta,"Margarethe von Trotta, Pamela Katz",6.7,2h 16min,"After the death of her father, Hannah becomes concerned with the strange behavior of her mother. As her mother's troubled childhood is revealed, Hannah realizes how little she ever knew."
tt0296245,Mario Caniglia,Mario Caniglia,,,Dirección
tt0295838,Richard Burridge,Richard Burridge,6.4,1h 31min,"Jack Littlemore's in art security, but he's already in enough trouble - then an old friend comes out of his past and threatens to finish him off completely."
tt0297853,Julian Kean,"Sally Charlton, Graeme Clapperton, Bill Dale",4.5,1h 30min,Environmental activists encounter a mysterious and deadly presence.
tt0298737,Mark Whiting,"August Hall, Mark Whiting",6.3,16min,"On the eve of Halloween, 1938, CBS radio reported UFO's in the skies over the United States. That same night, two notorious criminals escaped the maximum security prison at Macatawa... They were never seen again. Apple Jack is a high brow story about low brow people caught in a divine intervention."
tt0296587,Thomas De Thier,Thomas De Thier,6.3,1h 46min,Dirección
tt0297871,Robert Schwentke,Robert Schwentke,6.9,1h 27min,A man who loses a very personal part of his body to cancer decides he wants it back in this offbeat black comedy.
tt0298125,Hugo Lescano,Axel Nacher,7.7,1h 21min,"A retired police chief plans to return from brazil bearing false documents and information about the change of border guards, together with two guns. his sole aim is to reach the village of ontiveros, where his ex-wife is now openly living with the police commissioner of that area."
tt0298082,Cédric Klapisch,"Santiago Amigorena, Cédric Klapisch, Alexis Galmot",6.4,1h 51min,"""Ni Pour, Ni Contre"" tracks the fall of a young TV camerawoman, Caty, after she becomes involved with a group of petty criminals and their enigmatic leader, Jean. The gang lives hand to mouth until the day Jean plans a daring bank for robbery."
tt0299868,Bernar Hébert,"Leonard Cohen, Peter Putka",5.7,1h 41min,"To live in the Here and Now, and write poems, that is what Leo wants - unlike the women who fall in love with him."
tt0299458,David Gordon Green,"David Gordon Green, Paul Schneider",6.7,1h 48min,Small-town love story of a young man with a reputation for womanizing and his best friend's sister.
tt0300015,Tim Fywell,"Dodie Smith, Heidi Thomas",6.8,1h 53min,A love story set in 1930s England that follows 17-year-old Cassandra Mortmain and the fortunes of her eccentric family struggling to survive in a decaying English castle.
tt0300069,Stuart Gillard,"Nicholas Di, Bella",5.7,1h 34min,"Randy Quaid stars in this uplifting, action-packed coming-of-age story about an aspiring racer with a need for speed, a passion for the racetrack and a hunger for victory!"
tt0301357,Wolfgang Becker,"Bernd Lichtenberg, Wolfgang Becker, Achim von Borries",7.7,2h 1min,
tt0301777,Greg Pak,Greg Pak,6.0,1h 25min,"Four tales: a robot baby as a pre-adoption test, a mother and her dying son's toy robot collection, a lonely robot office worker, and a sculptor contemplating robot-enabled immortality."
tt0301989,Richard Franklin,Everett De Roche,5.0,1h 40min,"The story of Georgia Perry, the first woman to sail around the world solo."
tt0301181,Gary Hardwick,"James Iver Mattson, B.E. Brauner, Gary Hardwick",6.0,1h 45min,Eva doesn't let her 3 sisters' men push them around. She's always butting in. How to pacify Eva? Find her a man. The men pay a playboy to be that man. The problem is - he falls in love with Eva.
tt0302018,Dan Patton,Dan Patton,5.6,1h 25min,Dirección
tt0302361,Mark Illsley,Michael Bacall,5.9,1h 28min,"Centers on four college friends who become small-time bookies, only to find their world spinning dangerously out of control when their greed attracts the attention of organized crime."
tt0302566,Lloyd A. Simandl,Chris Hyde,4.3,1h 33min,"A woman must go undercover to break up a White Slavery ring. Thing get complicated when she fall for a handsome investigator, but must act the part of a lesbian."
tt0301360,Kadir Sözen,Kadir Sözen,5.7,1h 35min,"Heinrich Lutter (Götz George) is an unemployed locksmith. He lives with his two sons Mike (Markus Knüfken) and Günni (Bastian Trost) in Cologne, Ehrendfeld - a worker's district. Both need his unrestricted attention: Mike has a police record and Günni is mentally handicapped from birth. His only stability is his camper - for him it is a symbol of liberty and a fulfill... Leer todo"
tt0301976,Matthew Ryan Hoge,Matthew Ryan Hoge,7.0,1h 48min,
tt0301604,Leonardo Fabio Calderón,"Leonardo Fabio Calderón, José Sbarra",7.4,1h 30min,"Marc, a young borderline, tries to commit suicide by throwing himself onto the train tracks and is stopped by a policeman who will try to convince him to give up his idea."
tt0301744,Penny Woolcock,"Tim Cooke, Penny Woolcock",5.0,1h 48min,
tt0301730,Jean Veber,Jean Veber,5.2,1h 24min,An ecological pharmacist uses ancient Celtic techniques to murder industrial magnates whose practices harm the planet.
tt0302436,Mike Barker,Jenny Mayhew,6.2,1h 42min,"A recounting of the relationship between General Fairfax and Oliver Cromwell, as they try to cope with the consequences of deposing King Charles I."
tt0303830,John Sayles,John Sayles,6.4,1h 35min,A brief look into South American family life while showing the hardships surrounding adoption in South America as six woman are forced to stay in the country while awaiting approval of adopting a baby.
tt0302713,Manne Lindwall,"Mikael Bengtsson, Ola Höglund, Lovisa Löwhagen",4.8,1h 29min,"9-year-old Simon, bullied at school by Alex, has a real lion as a companion, a beast that has the strength he himself lacks."
tt0303758,Mark L. Lester,"Jeffrey Goldenberg, C. Courtney Joyner, Sonja Massie",4.3,1h 28min,"Jayne Ferré needs to get out of Los Angeles ASAP. A strikingly-beautiful woman, yet ruthless assassin for the mob, she is on the run with a suitcase full of a million dollars in blood money stolen from mob boss Frank Bianci. Sixteen-year-old Kerry is on the run from a drug dealer set on payback. His mother Emily decides to take him and start a new life in Texas, but d... Leer todo"
tt0304897,Dominique Boccarossa,Dominique Boccarossa,3.3,1h 30min,"The story is inspired by the biblical myth of Lazarus. The main character is called Lazarus who was a follower of Jesus, brother of Martha and Mary who was resurrected by Jesus."
tt0304858,Aaron Schneider,"William Faulkner, Aaron Schneider",7.1,40min,"Mississippi, just before Pearl Harbor. Two brothers, Pete, about 19 and Willie, about 10 years younger. They are clearly close friends. The news arrives, and Pete goes to enlist. Willie wants to come along, but is told he cannot. After his brother leaves, the boy walks 30 miles to the nearest town, where the sheriff eventually puts him on a bus to Memphis where his br... Leer todo"
tt0304328,Ed Solomon,Ed Solomon,6.4,1h 40min,"After two decades in prison for murder, a man is released on parole and returns to his hometown seeking redemption."
tt0305206,"Shari Springer Berman, Robert Pulcini","Harvey Pekar, Joyce Brabner, Shari Springer Berman",7.4,1h 41min,
tt0304600,Jacques Cortal,Jacques Cortal,5.0,2003,"Professional dancer, Margot suffers from cancer. As she battles the disease, her husband drowns her grief in the arms of other women."
tt0305178,Ra'anan Alexandrowicz,"Ra'anan Alexandrowicz, Sami Duenias",7.4,1h 31min,During his journey to Jerusalem young James learns the meaning of being Israeli.
tt0305574,Ringo Lam,"Mike Cassey, Ringo Lam",5.8,1h 41min,"A policewoman has always had the worst luck in love. On a trip to Malaysia, she finally meets the man of her dreams. However, her Perfect Man might not be all he appears to be."
