0,1,2,3,4,5
tt0407254,Chris Eyre,"Scott Garen, Joy Harjo",7.5,42min,The lives of four Native Americans take a significant turn as they confront the crises that arise in a single day.
tt0407230,Erik Canuel,"Diane Cailhier, Germaine Guèvremont",6.4,2h 18min,"A stranger knocks on Didace his door. As he refuses to name himself, he is nicknamed the Survenant. Didace soon realized that this stranger, in addition to being a good worker, is a cheerful fellow who brings life to a house."
tt0406914,Milan Cieslar,Vladimír Körner,6.3,2h 6min,"An intimate ballad following the lives of a mother and daughter who go through topsy-turvy historical times. The plot is divided into four seasons set between 1939 and 1961. A Czech woman named Helga works at a German hospital. Out of her love for a Baltic nobleman named Arno, a volunteer in the Finnish War, her daughter Dorli is born. But Arno commits suicide and aft... Leer todo"
tt0407236,Jan Svankmajer,"Edgar Allan Poe, Marquis de Sade, Jan Svankmajer",7.2,1h 58min,"A man takes up residence with a mysterious marquis and is soon persuaded to enter into an asylum for preventative therapy. Things are not what they seem, and the marquis may be even more sinister than what the young man may've predicted."
tt0407095,Cameron Watson,Cameron Watson,6.0,1h 46min,"Itching to leave small-town life in Shelbyville, Tennessee, five friends are sent into a frenzy when they learn that hometown-girl-turned-Hollywood-star Sondra Locke could be returning."
tt0407205,Arthur Allan Seidelman,"Richard Alfieri, Anton Chekhov",6.0,1h 53min,"Based on Anton Chekov's ""The Three Sisters"" about siblings living in a college town who struggle with the death of their father and try to reconcile relationships in their own lives."
tt0407826,Kræsten Kusk,Kræsten Kusk,,,Dirección
tt0408162,Jeff Winner,Jeff Winner,6.7,1h 40min,SATELLITE is a romantic fable about a young couple who give up everything they have in order to find something better.
tt0408120,Petr Zelenka,Petr Zelenka,7.2,1h 40min,"A black comedy based on director Petr Zelenka's successful stage play. It treats a simple theme: Jana has left Petr (Ivan Trojan), a boy 'who's not doing very well at the moment,' and he wants her back. In a film in which love seems like madness (and vice versa) many bizarre things rise to the surface. Petr's mother (Nina Divísková) sends blood to Chechnya. His father... Leer todo"
tt0407947,Benjamin Holmsteen,Benjamin Holmsteen,6.2,19min,"A man carries his dead wife to the trunk of a car in front of their 4-year-old daughter. All together they drive to a lake far into the forest, where the father plans to dump the body and end the lives of himself and his daughter. However, everything is not what it seems..."
tt0408318,Dagur Kári,"Dagur Kári, Rune Schjøtt",7.1,1h 49min,A young man spurs romance and helps his friend and himself go through times and struggles of their ordinary life in Denmark.
tt0408133,Andrea Bolognini,"Luigi Bazzoni, Suso Cecchi D'Amico, Masolino D'Amico",7.6,1h 37min,Dirección
tt0407998,Paul Mayeda Berges,"Gurinder Chadha, Paul Mayeda Berges, Chitra Banerjee Divakaruni",5.5,1h 32min,"An immigrant in San Francisco brings Indian magic with her through spices. To keep the magic, she must never leave the spice store or touch another's skin. One day, a handsome architect bachelor enters her store."
tt0408306,Steven Spielberg,"Tony Kushner, Eric Roth, George Jonas",7.5,2h 44min,
tt0408302,Martin Koolhoven,Mieke de Jong,6.8,1h 23min,"Bonnie, a nine-year-old single child, is part of a family of three living in the Netherlands. They have a love of elephants, passed on by Bonnie's grandfather's grandfather who worked on a game reserve in Africa, and Bonnie feels that she instinctively does things like an elephant as a result. Her single mother, Lis, is bi-polar and at times spends days on end without... Leer todo"
tt0409678,José Alcala,"José Alcala, Olivier Gorce, Agnès de Sacy",6.3,1h 40min,"In the quiet mountains of Ardèche, in France, a staunchly independent woman tries to connect with her wary, mistrustful teenage son."
tt0408852,Alex Alamul,Natalie Zhivolup,5.7,2005,"Robbery. Murder. Rape. All in a days work for a young psychopath. But his latest hostage isn't exactly an angel either. Blackmailing her neighbor to cure him of cheating on his wife turns out to be not such a good idea. As Martin cuts a bloody swath through the back roads of the San Francisco Bay Area with Jennifer in tow, two S.F. Homicide detectives race the clock t... Leer todo"
tt0408790,Robert Schwentke,"Peter A. Dowling, Billy Ray",6.3,1h 38min,
tt0409838,"Doug Mc, Keon","Stephen Zakman, Robert D. Slane",6.6,1h 42min,A friendship develops when 12-year-old Annie is coerced to stay with her Grandpa Donald.
tt0409081,Jason Ford,Jason Ford,6.2,1h 26min,Dirección
tt0409184,Cédric Klapisch,Cédric Klapisch,7.0,2h 5min,
tt0410162,Lek Kitaparaporn,Sean Casey,3.5,1h 32min,"Fernando De Gama, a Portuguese mercenary, sets sail for the Orient, where he reaches the Thai kingdom of Ayutthaya, in a bid to find the man that murdered his father."
tt0409527,Leena Yadav,"Sutapa Sikdar, Leena Yadav",5.1,2h 20min,"When a novelist seeks inspiration by urging his wife to have an affair, the line between his story and reality is blurred."
tt0410381,Santiago García de Leániz,"Josep Bonet, Santiago García de Leániz, Tatiana Rodríguez",4.9,1h 46min,Young man confronts family history horrors in rural drama.
tt0409034,Randall Miller,"Randall Miller, Jody Savin",6.5,1h 44min,A widowed man's life turns upside down when he embarks on a journey to find a dying man's long lost love.
tt0410516,Greg Carter,Keith Kjornes,7.8,2h,"The story of famed Houston Astros Fastball Pitcher J.R. Richard, from his high school days in Louisiana, his first round draft pick in 1969, to the massive stroke he suffered in 1980, to his abandonment by the only team he ever played for, to his living as a homeless man under a Houston bridge, to his Resurrection by friends and fans back into baseball."
tt0410275,Vlamyr Vizcaya,Vlamyr Vizcaya,,,"A man obssesed with videotaping every moment of his life, is forced to question his current relationship when a new girl enters the picture. Mixing material from his own life with interviews, he sets to do a documentary to learn more about women, love and sex, only to realize that there are some questions that should not be asked."
tt0410445,Jean-Pierre Denis,"Jean-Pierre Denis, Pierre Péju, Yvon Rouvé",6.5,1h 30min,"Eight-year-old Eva and her mother have a very positive CHILD-TO-CHILD-RELATION. The mother is incapable of mature behaviour when problems arise. When the mother forgets to fetch Eva at school in her car, Eva does not know the way home. Panicking and crying she just runs and is overrun by a car. The driver is obviously innocent. He is a second-hand bookseller (Etienne)... Leer todo"
tt0410400,Gaby Dellal,Alex Rose,6.9,1h 35min,Frank determines to salvage his self-esteem and tackle his demons by attempting the ultimate test of endurance - swimming the English Channel.
tt0410410,Valérie Minetto,"Valérie Minetto, Cécile Vargaftig",6.4,1h 26min,"Cheyenne, a journalist, decides to leave Paris after being laid off and to settle down in the middle of nowhere, far from the society she hates.The trouble is that she leaves Sonia, her true love, behind. The latter, a teacher who loves her job, refuses to give up everything -including her comfort- to follow her. Sonia makes all the efforts in the world to forget Chey... Leer todo"
tt0110476,Yuriy Kara,"Mikhail A. Bulgakov, Yuriy Kara",6.4,2h 5min,"Interwoven are a satire of the 1930's under Stalin, the inner struggle of Pontius Pilate around the execution of Jesus, and the love story between a writer in Moscow and his lover Margarita."
tt0136517,"Don E. Faunt, Le, Roy","Ria Coyne, Peter Evans, Robert Nashak",3.4,1h 28min,"Four women - a blonde, a hippie, a lesbian and a barmaid - are looking for love, money and success. When one inherits an Italian restaurant from her father, they see this as a chance to fulfil their dreams. Then the restaurant is in danger of closing down - and the girls pull out all the stops to save it."
tt0138992,Jack Swanstrom,Shane Black,5.5,20min,"Vietnam. 1972. US Army Special Forces Major Cliff Marquette leads a squad ordered to investigate unusual reports and secure a remote jungle temple locals believe has mystical powers. The Marines guarding the temple have withheld provisions for days from a Viet Cong prisoner. Despite severe mistreatment, the prisoner mysteriously shows no signs of suffering. Marquette ... Leer todo"
tt0166871,José Fonseca e Costa,"João Constâncio, José Fanha, José Fonseca e Costa",6.7,2h 15min,"Ana Catarina returns home to marry a man she doesn't know. A terrible coincidence happens when, on the same day, the young woman becomes a widow and an orphan, which leaves her heir to a fortune and coveted by the aristocrats in the region"
tt0168721,Gábor Reisz,Gábor Reisz,,,Dirección
tt0180283,Sage Stallone,"Will Huston, Sage Stallone",7.8,30min,"""Vic"" chronicles a few days in the life of Vic Reeves, a down-on-his-luck Los Angeles actor in his seventies. Haunted by memories of his former glory days in Hollywood, his dreams of returning to the limelight are revived by a late night telephone call that holds the promise of a major new role."
tt0206634,Alfonso Cuarón,"Alfonso Cuarón, Timothy J. Sexton, David Arata",7.9,1h 49min,
tt0260042,Robert Kevin Townsend,Robert Kevin Townsend,6.3,R,"When a young woman opts to abort a miraculous conception, a Christian Fundamentalist group intervenes. Duped into an adoption scheme, Maggie agrees to carry the baby to term but gradually comes to suspect the entire arrangement. She ends up marooned at a rural service station, where she encounters a wise old radio preacher, Isaiah, and his reluctant prophet of a son, ... Leer todo"
tt0259822,Gary Lennon,Gary Lennon,5.5,1h 41min,
tt0266732,Elliott Lester,"Wesley Strick, Steve Allison",5.5,1h 36min,A love triangle among recent high school graduates proves deadly.
tt0275258,Sheri Hellard,Robin Mackenzie,5.2,1h 30min,"Follows a day in the lives of three generations of women. Priscilla, her mother (Nana), and her daughter, Wendy, spend the day sipping gin, arguing and being chased by a police officer. Priscilla has a lump in her breast which may or may not be cancerous. Her husband is distracted and unappreciative. She is depressed, an unseen artist, whose mother is always nagging h... Leer todo"
tt0284363,Jirí Menzel,"Bohumil Hrabal, Jirí Menzel",7.3,1h 53min,A look at the glamorous life at an old-world Prague hotel.
tt0288476,"Pablo Bardauil, Franco Verdoia",Pablo Bardauil,5.9,1h 43min,Tells the hectic life of four residents of the same building in a neighborhood of Buenos Aires.
tt0296604,Juan Pablo Reinoso,"Juan Pablo Reinoso, R. Dale Whisman",7.7,2006,"A young Korean War veteran returns home to find his parents have died and his wife has left him for another man. With no known family, he leave his California roots for middle America in search of what may be a distant cousin. When he arrives he finds that the cousin has been missing for your years, leaving behind a wife and five daughters living in a small town full ... Leer todo"
tt0302545,Peggy Bruen,Peggy Bruen,4.0,1h 20min,"The story of two lovers, a woman and a Young Republican, who meet in hotel rooms over the 1990s to explore their sexual prowess. Only when they venture out of 'the box' does reality start to tear at the fabric of their private, existential affair. Nothing stays the same. They marry. Guess what happens next?"
tt0308055,Emilio Estevez,Emilio Estevez,7.0,1h 57min,"The story of the assassination of U.S. Senator Robert F. Kennedy, who was shot in the early morning hours of June 5, 1968 in the Ambassador Hotel in Los Angeles, California, and twenty-two people in the hotel, whose lives were never the same."
tt0311862,Frank Robak,Frank Robak,5.8,2006,"""STATISTICS"" tells the story of six individuals who all share one thing in common: they will become statistics by the end of the day. They are neither heroes nor criminals, but everyday people who will become victims of everyday life. The events that take place will be read about today and forgotten tomorrow, but in that blink-of-an-eye, their lives and the lives of t... Leer todo"
tt0314186,Bunty Soorma,"Ashok Roy, Javed Siddiqui, Bunty Soorma",5.3,2h 8min,"A blind woman is taken care by a wealthy nobleman after her fiancee is presumed to be dead. Things takes a turn when her former fiancee comes back to her, which puts her in a dilemma."
tt0321858,Jamal Joseph,,3.9,1h 33min,Two rival basketball stars are forced to face their respective prejudices.
tt0323120,Katherine Brooks,"Katherine Brooks, Olivia Bohnhoff Harris, Karen Klopfenstein",6.3,1h 17min,"The intelligent Annabelle starts in an elite Catholic girls' boarding high school after being expelled from the previous 2 schools. She's open about being lesbian. She's attracted to her teacher, Simone."
tt0325011,Michele Soavi,"Massimo Carlotto, Lorenzo Favella, Michele Soavi",6.9,1h 47min,"Giorgio Pellegrini, a former left-wing activist turned terrorist has fled to Central America and fought with a guerrilla movement. Fifteen years later he is fed up with living in the jungle and decides to return to Italy. What he wants is to lead a comfortable bourgeois life in his native country. Thanks to Anedda, a corrupt police inspector, and after giving away for... Leer todo"
tt0328179,Stephen Pidgeon,"Stephen Pidgeon, Phil Lott, Kevin Markwick",4.9,1h 29min,Four British buddies agree to arrange a home-alone party as the ultimate solution to their problems with the opposite sex.
tt0329239,"Seung-wook Moon, Nobuhiro Suwa, Xiaoshuai Wang",,6.5,1h 59min,Dirección
tt0337609,Brian Lawrence,Brian Lawrence,5.4,1h 35min,"The action crime-thriller, CORRUPTED MINDS, revolves around a gang of revolutionaries who are about to cause mayhem for the citizens and cops of the Motor City."
tt0339756,Walter Stewart,Walter Stewart,6.1,2006,Dirección
tt0339382,Diego de la Texera,"Regiana Antonini, Marcos Bernstein, Diego de la Texera",6.1,1h 57min,"In the early 1960's, a group of people responsible for the construction of the Brasilia-Fortaleza road is abandoned in the middle of the jungle by the Brazilian government, after the military coup."
tt0345228,Mia Goldman,Mia Goldman,6.1,1h 37min,The engagment between a struggling photographer and an assistant professor is marred by an act of violence.
tt0343737,Robert De Niro,Eric Roth,6.7,2h 47min,
tt0350183,Vlado Cvetanovski,"Ljube Cvetanovski, Jordan Plevnes",7.2,1h 34min,"The search for the Secret Book of the Bogomils brings Guy Chevalier (Thierry Fremont) to Macedonia. There, he is haunted by the spirit of the Gardian of the book and followed by unknown forces. Little by little, he starts loosing his mind and his identity."
tt0349467,Joe Roth,Richard Price,5.2,1h 53min,
tt0353357,Adrian Rudomin,Adrian Rudomin,5.4,1h 49min,"Set in the 16th century, a sheriff working on a series of murders has to choose between his conscience and protecting his family when he's tied to the crimes."
tt0353667,Torsten C. Fischer,"Torsten C. Fischer, Dieter Wellershoff",5.7,1h 52min,"When she was a student, Anja worked in the department of Lars and Marlene, two soon-to-be married doctors. At the time, she worked with one of the couple's friends, Leonhard, whom she eventually married and with whom she had a child"
tt0354131,Martin Munthe,Martin Munthe,5.0,2006,Dirección
tt0354899,Michel Gondry,Michel Gondry,7.2,1h 45min,
tt0359353,Jon Hewitt,"Jon Hewitt, Belinda Mc, Clory",7.2,1h 32min,two star cross'd lovers plunge into the neon KX night chasing a happy ending.
tt0358924,Verónica Chen,"Verónica Chen, Pablo Lago",6.0,1h 29min,"Thirty four year old Goyo, a former open water swimming champion, has been hiding out in the desert. Wrongly accused of doping in the Santa Fe-Coronda Marathon, a 57 kilometer river swim, he has abandoned his career and his dreams. Eight years later, Goyo returns to Santa Fe where the marathon will be held again to try to re-gain his title and clear his name. However,... Leer todo"
tt0361786,Miroslav Aleksic,Miroslav Aleksic,4.6,1h 35min,"Jovana and Aleksa are young people, linked by fate since childhood. Forced to move from the area where their ancestors lived for centuries, trying to find and secure the place to live in their new environment. Faced with the loneliness, and separation, because Alex works abroad in order to pay for the house, and they collide with the unsolvable problem for them - a fr... Leer todo"
tt0360323,Bobby Moresco,"Bobby Moresco, Allan Steele",6.3,1h 47min,"A former street tough returns to his Philadelphia home after a stint in the military. Back on his home turf, he once again finds himself tangling with the mob boss who was instrumental in his going off to be a soldier."
tt0362225,Guillaume Canet,"Guillaume Canet, Harlan Coben, Philippe Lefebvre",7.5,2h 11min,
tt0362993,Matthew Harrison,Matthew Harrison,7.5,1h 26min,An electronic retelling of Dante's INFERNO as a New York City love story.
tt0364745,Jim Wilson,"Pete Mc, Cormack",5.6,1h 35min,A studious student finds adventure when he follows a mysterious woman to New York.
tt0364955,Terry Zwigoff,Daniel Clowes,6.3,1h 42min,"Starting from childhood attempts at illustration, the protagonist pursues his true obsession to art school. But as he learns how the art world really works, he finds that he must adapt his vision to the reality that confronts him."
tt0367683,Karen Elisabeth Hjermind,Karen Elisabeth Hjermind,,,Dirección
tt0367027,John Cameron Mitchell,John Cameron Mitchell,6.4,1h 41min,
tt0367567,José Pepe Bojórquez,"José Pepe Bojórquez, David Howard",6.1,1h 39min,"On an island across the sea lies a village full of romance, wonder and mystery; a timeless place where people carry strong beliefs that can fulfill the heart's deepest desires. A beautiful woman, led to believe she has powerful ties to the sea, defies everyone to prove them wrong, in a world where man and nature connect in improbable ways, where myths are real and tru... Leer todo"
tt0366180,A.R. Murugadoss,"A.R. Murugadoss, Gopalakrishna Paruchuri, Paruchuri Venkateswara Rao",6.0,2h 48min,The story is about how an ex-army officer brings change in society by making people to help each other.
tt0369072,Osvaldo Daicich,"Osvaldo Daicich, Xenia Rivery, Serguei Svoboda",,,Dirección
tt0368863,Horacio Muschietti,"Horacio Muschietti, Marcelo Muschietti",7.8,1h 25min,On his wedding day a young man falls in love with his friend's daughter. The film portrays the conflict that arouses after the pressure that both family and friends have exercised over the young man.
tt0370893,Marek Rozenbaum,Haim Marin,5.8,1h 35min,Dirección
tt0373900,Chris Fisher,"Chris Fisher, Aaron Pope",4.3,1h 25min,"Kenneth Bianchi, one of the two serial rapists and killers who terrorized the Los Angeles area in the late 1970s, is giving police station interviews to psychiatrist Samantha Stone, who is forced to relive the horrific crimes."
tt0373999,Veljko Bulajic,"Ivo Bresan, Veljko Bulajic, Mirko Kovac",5.0,2h 10min,"The film is set in mid-16th century, at a time when the entire eastern Mediterranean is dominated by two great empires, the Ottoman Empire and the Republic of Venice, with the small but wealthy maritime republic of Ragusa (modern-day Dubrovnik) managing to maintain its independence through diplomatic agreements."
tt0375154,Kevin Reynolds,Dean Georgaris,6.8,2h 5min,
tt0378816,Elana Krausz,Elana Krausz,5.3,1h 36min,"A surrealistic feminist art statement stuffed inside a candy-coated exploitation bubble. While serving up images of gyrating nubile female strippers, Elana Krausz s film forms a critical dialog about modern feminism. Lily is a former stripper and manager of a seedy strip club. She is wise, but submissive, allowing herself to succumb to years of objectification and abu... Leer todo"
tt0377904,Pasquale Marrazzo,"Lorenzo Loris, Pasquale Marrazzo",6.0,1h 30min,"Francesco, a young man from Naples, who prefers to be called Francesca, shares with the Italian girl Giada an apartment in Berlin. Together they dive into the world of prostitution. Through one of his clients, Andreas, Francesco meets Suzanne, a 38 year old woman, and a former political prisoner. Suzanne - searching into her past through a dossier on herself compiled ... Leer todo"
tt0377320,Shira-Lee Shalit,Damon Shalit,5.8,1h 38min,"Darren goes to Hollywood in an attempt to live the American dream of becoming a big-name actor. When Darren is mistaken for Dante, the A-List actor in town, his world is thrown upside down - and he gets his wish, for better or for worse."
tt0381658,Eisha Marjara,Eisha Marjara,5.8,25min,"Ron, a Canadian tourist in Munich, is a loner with a camera whose sole passion is for fotography. When he meets Bernie, the producer, and Julia, the actress, an outgoing couple obviously in love, his attention turns from his camera to his true object of desire."
tt0381053,Daniel Mellitz,Daniel Mellitz,4.6,2006,The Naked Ape is a coming-of-age film following three teenagers on a road trip across the Pacific Southwest.
tt0383478,Kyle Bergersen,Kyle Bergersen,5.3,1h 29min,A young man is hired as the executioner at a prison where his brother sits on death row. Things get more surreal when he falls in love with his brother's ex-girlfriend -- who's imprisoned herself.
tt0382765,Ray Lawrence,"Beatrix Christian, Raymond Carver",6.3,2h 3min,
tt0384798,Richard Rossi,Richard Rossi,4.9,1h 50min,"A feature film about the life of Aimee Semple McPherson, the famed evangelist of the 1920s."
tt0384814,Robert Towne,"Robert Towne, John Fante",5.7,1h 57min,
tt0385757,Miguel Pereira,"Miguel Pereira, Héctor Tizón",6.0,1h 30min,"DESTINY (2006) Based on the novel ""The man who came to a town"" by Hector Tizon (Argentina, 1929) who in 1976 was exiled to Spain, where he worked in publishing houses, newspapers and magazines. A Spanish drug dealer has to close a transaction in the remote region of Jujuy, Argentina. Almost killed it. Chance will make you have to hide in a remote village disguised as ... Leer todo"
tt0385726,James Gartner,"Christopher Cleveland, Bettina Gilois",7.2,1h 58min,
tt0387877,Brian De Palma,"Josh Friedman, James Ellroy",5.6,2h 1min,
tt0386486,"Hank Stone, Roy Kurtluyan",Buddy Dolan,4.1,1h 32min,A man wakes after twelve years only to find he has an unwanted ability to see the dead.
tt0390245,Aleksi Mäkelä,Marko Leino,5.9,2h 15min,"A ski jumper descends from winning 4 Olympic Gold Medals, to serving two years for stabbing a relative. Careers as a stripper and singer, plus five marriages, replete with allegations of domestic violence are fictionalized sympathetically in this dramedy. Alleged exploitation/manipulation of Matti, due to his naivety and gullibility, along with deterioration of his sk... Leer todo"
tt0389860,Frank Coraci,"Steve Koren, Mark O'Keefe",6.4,1h 47min,
tt0389557,Paul Verhoeven,"Gerard Soeteman, Paul Verhoeven",7.7,2h 25min,
tt0391488,Daniel Duval,"Daniel Duval, Elie Meirovitz",6.1,1h 34min,"In 1950s France, a young boy is taken in by a couple after spending a few months in the care of social service."
tt0391788,Eyal Shiray,Uzi Weil,5.8,1h 30min,A young boy finds a stack of his sister's secret letters who's been missing since their mother's death. He sets off on the journey of a lifetime to reunite with her and he meets a man who calls himself the last true Communist.
tt0392883,Pan Nalin,"Pan Nalin, Sarah Besan Shennib, Anurag Kashyap",6.9,2h 35min,"A great Asian love story, an unforgettable tale about passion, death and reincarnation. A mesmerizing Himalayan epic that spans two centuries, from the Silk Route of the early 19th century to the bustling metropolis of modern-day Tokyo."
tt0393297,BJ Davis,Julia Davis,4.6,1h 28min,"In this hilarious adventure, starring Raquel Welch, Burt Reynolds, and Robert Loggia in their last film together, when three retired war vets stumble upon a stash of mob money, they find themselves running from both the Mafia and the feds."
tt0393813,Mischa Alexander,Mischa Alexander,6.8,1h 40min,Taeke's lifelong passion for pole sitting takes an interesting turn when he tries to surpass the record of 250 days.
tt0395269,Wyeth Clarkson,"Wyeth Clarkson, Elan Mastai",5.9,1h 25min,A group of skaters are assembled to make a video at a legendary spot. They soon discover its days are numbered and band together to save it.
tt0395119,Agustín Díaz Yanes,"Arturo Pérez-Reverte, Agustín Díaz Yanes, Carlota Pérez-Reverte",6.1,2h 25min,
tt0395495,Susannah Grant,Susannah Grant,5.9,2h 4min,
tt0396171,Tom Tykwer,"Andrew Birkin, Bernd Eichinger, Tom Tykwer",7.5,2h 27min,
tt0396575,Gyula Nemes,"Tamás Beregi, Gyula Nemes",5.8,1h 16min,Dirección
tt0396476,Jag Mundhra,"Carl Austin, Sameer Ketkar, Jag Mundhra",3.9,1h 26min,
tt0397313,Frank Marshall,"David Di, Gilio, Toshirô IshidôKoreyoshi Kurahara",7.3,2h,
tt0397551,Rajeev Virani,"Brad Listermann, Richard Martini, Kashmira Shah",4.8,1h 35min,"My Bollywood Bride tells the story of Alex, a copy-writer dreaming of being an adventure novelist someday, who meets and romances Indian beauty Reena, while she is vacationing in California. Torn by her blossoming feelings for Alex and her Indian family values and obligations, Reena returns home without saying goodbye. Alex, distraught by the turn of events, decides t... Leer todo"
tt0398842,Armand Mastroianni,"James Redfield, Barnet Bain, Dan Gordon",4.8,1h 39min,An adaptation of James Redfield's novel about the search for a sacred manuscript in the Peruvian rain forest.
tt0398029,Colin Teague,"Gary Young, Colin Teague",4.5,1h 43min,Different factions in World War II Holland race to find a stash of German gold.
tt0399110,Michael T. Fitzgerald Jr.,Lee Eric Smith,1.8,1h 29min,"Nine friends one crazy night, grad night."
