0,1,2,3,4,5
tt0822811,Michael Worth,Michael Worth,8.4,1h 57min,"Noah Connelly is a boxer with a tireless opponent: Autism. But when he meets a dancer named Alexia, the two discover together that the toughest fight may be not be of the body, but of the heart."
tt0822785,Dany Saadia,"Dany Saadia, Alejandro Valdés",5.6,1h 30min,"What if everything in life was down to chance? What if we couldn't escape fate? What do Galois, Bauhaus and The Unbearable Lightness of Being have in common? What if the sweat in our brow could save us from the dust we are destined to return to?"
tt0824330,Dirección,Jean-Paul SaloméLaurent Vachaud,6.7,2h 28min,
tt0826608,Rob Nilsson,Rob Nilsson,7.7,2008,"Rob Nilsson's powerful and complex tale dives into the heart of a man driven to confront his past in order to heal the pain of the present. Danny (Kieron McCartney) is a tortured man-child who returns to his family's abandoned island retreat and finds himself beset by fantasies of deceased ancestors, former lovers and concerned friends. Frazier (Robert Viharo) is Dann... Leer todo"
tt0826756,David Oliveras,David Oliveras,6.4,1h 54min,A story about two classmates - one smart and openly gay and the other school swimming star. They grow as friends and discover their attraction to each other.
tt0827181,K.C. Bascombe,Gregory Rosati,5.1,1h 37min,"A modern day Bonnie and Clyde - with a twist - that follows two lovers down a path of destruction, mayhem, and murder as they live in a world where it is acceptable to take whatever they want with murderous consequences."
tt0827763,Cyrus Frisch,Cyrus Frisch,7.0,1h 10min,"What are the mechanisms by which we arm ourselves against the cruelty of the world? Do we really care about war, hunger and disease? A man (Roeland Fernhout) travels through a desert-like landscape and tries to answer these questions."
tt0828393,Jason Freeland,Jason Freeland,5.5,1h 28min,"April (age 15) is running from one bad situation into another, hoping to find an answer that doesn't involve nudity, and falls in with a group of confused kids chasing their dreams. The black widow in the web is the sexy, pot-dealing Sally."
tt0829442,"Duane Graves, Justin Meeks","Duane Graves, Justin Meeks, Dale S. Rogers",4.6,1h 26min,"Based on the recently acquired journals of Texan Dale S. Rogers, this vintage horror tale from IFC Films debunks history books to tell the veracious, harrowing story of a rural Texas community whose residents were terrified for years by a mysterious creature inhabiting the nearby woods."
tt0829432,Dave Christiano,Dave Christiano,4.1,1h 32min,A love story based in 1974 and 2004: A 47-year-old Christian man on the other side of an unwanted divorce reminisces about his high-school girlfriend from 30 years prior.
tt0829154,Henric Brandt,"Stefan Bommelin, Henric Brandt",6.7,1h 44min,A young couple out on a romantic vacation accidentally get involved in a showdown between criminals. They become two witnesses who has to be silenced.
tt0830570,Shamim Sarif,"Shamim Sarif, Kelly Moss",6.5,1h 22min,
tt0830813,Nicolás León Tannchen,Nicolás León Tannchen,6.6,1h 22min,"December 2001, Pablo lives in Buenos Aires in the middle of the worst economic crisis in Argentina. It is not easy for him to find a job and if he does, he is fired almost immediately. He lives alone in a small apartment and his main objective is to find a woman."
tt0830535,Glenn Gers,Glenn Gers,6.5,1h 36min,"Lydia is an overweight sales clerk in a trendy home furnishings store, nearing 30. Though she is a member of a Fat Acceptance Group (a movement dedicated to fighting prejudice against overweight people), she is still struggling with complex feelings about her body and its place in the world. Darcy, a recovering-anorexic real estate agent in her mid-20s, is struggling ... Leer todo"
tt0830924,Tamás Almási,"Tamás Almási, Margit Halász",6.1,1h 31min,"An Italian businessman, Mario comes to the country and opens his shoe company in a small village. A middle-aged female worker falls in love with Mario, but she is not the only one whose life will be changed."
tt0831328,Keith Feighan,Keith Feighan,8.5,2008,"Shane Canning, a lost twenty-something, struggles with the effects of alcohol on his family and friends, ultimately leading to a discovery that their alcohol related behaviors are not what they seem."
tt0831277,Isaac Pingree,Sebastian Passanisi,4.9,1h 30min,"Jake Reid's father died in a bloody massacre 15 years ago in Covelo, California, after participating in a botched robbery-the loot from which was never found. Jake comes to this small western town to dig up the past and to dig up the money-he digs too deep. As he uncovers the circumstances of his father's death, Jake enlists the help of the daughter of a man his fathe... Leer todo"
tt0831275,S.A. Halewood,"S.A. Halewood, Sergey Sakin, Pavel Teterskiy",6.2,1h 22min,Spiker & Cobakka are two self-confessed 'pieces of Moscow scum' who come to London to rip it off. This is their guide.
tt0832266,Adam Brooks,Adam Brooks,7.1,1h 52min,
tt0833557,Jared Drake,Brandon Drake,5.9,1h 34min,"When people begin exploding from stress, George Washington Winsterhammerman tries to ignore the epidemic and live his usual life, but then he suffers his first symptom."
tt0834171,Ain Mäeots,"Ülle Kahusk, Mart Kivastik, Ain Mäeots",6.5,1h 34min,An ethnographic musical drama about a Seto (regional ethnic minority in South-Eastern Estonia) folk-singer Hilana Taarka.
tt0833960,Damian Harris,Damian Harris,6.8,1h 50min,"After being abducted as children, and suffering years of abuse, a teenage boy and girl find themselves living on the street."
tt0833878,Edward J. Mallillin,Edward J. Mallillin,7.0,2008,Dirección
tt0834952,Chris Elston,Chris Elston,4.9,1h 41min,"With a catastrophic event rapidly approaching, 18 people vie for 10 spots in the small town's only bomb shelter."
tt0834967,Michael Mouyal,"Michael Mouyal, Dennis Goldberg",2.2,1h 22min,Helgi witnesses the destruction of his village and narrowly escapes to his uncle Rurik who raises him like his son. Many years later he meets the people responsible for his parents' deaths--and someone he never expected to see again.
tt0834927,Kevin Sullivan,Kevin Sullivan,5.8,1h 44min,"The Magic Flute's all pervading themes of love and betrayal, reward and retribution, coupled with the encompassing power of Mozart's score have given rise to a movie set during Mozart's 250th birthday celebration year. Young virtuoso singer Tom (Warren Christie) is cast against his better judgment in the lead role of Tamino in the staging of The Magic Flute in Salzbur... Leer todo"
tt0835372,Aloura Melissa Charles,Aloura Melissa Charles,8.2,2008,"A castaway, surrounded by water, suffers the most miserable thirst. The same ironic ache haunts lonely souls in the congested city of New York. But on this night, at a hotel, several strangers reach out and connect."
tt0835826,Nilanjan Neil Lahiri,"Ghalib Shiraz Dhalla, Akshat Verma",6.8,1h 45min,"A young, gay Indian flees to Hollywood, away from an overprotective mother and memories of his father's violent death. A successful banker by day, at night his life unravels in a blur of alcohol, drugs, and sex as he grapples with love, loss and ultimately, forgiveness. Based on actual events and the acclaimed novel by Ghalib Shiraz Dhalla."
tt0835828,Paolo Marinou-Blanco,Paolo Marinou-Blanco,6.8,1h 38min,"Two solitary men embark on a journey to find a missing woman, driven by friendship, a desire for freedom, and a wish to taste life to the fullest."
tt0837802,Matthew Wilder,Matthew Wilder,4.4,1h 46min,"The lines between reality and perception blur in this comic journey into the life and mind (literally!) of one of sci-fi's most brilliant authors. Paranoid conspiracies of the highest order, drug-fueled interdimensional shifts, and 1970's pop culture combine for the mind-bending adventure of the century."
tt0836700,Olivier Assayas,Olivier Assayas,7.1,1h 43min,
tt0837792,Louis Lombardi,"Evan Jacobs, Evan Jacobs, Louis Lombardi",4.8,1h 30min,"Frank and Lou are brothers, running the family's bakery, a fixture in their Bronx neighborhood since 1921. Lou loves it, but the rest of his life is in tatters: he lives alone, bets on the horses, and owes a loan shark. Frank, older, married, and always responsible, wants to get out of the bakery and pursue other dreams. Things come to a head on the day Lou's marker c... Leer todo"
tt0837794,Howard Libov,"Howard Libov, Michael Stewart",5.6,1h 30min,"A story of family, of dreams deferred, and of a final chance at redemption. David Paxton, nearing the end of his minor league baseball career, returns to his hometown as much less the hero he once assumed he would become. When he meets Joan, and her son Ross, David believes he has found a way to acquire the love, support and family he's long been yearning for. But his... Leer todo"
tt0840322,Ryan Little,"David Pliler, Dony West",7.1,1h 52min,
tt0841048,Manan Katohora,"S. Dwaipayan, Manan Katohora, Sumita Sheth",5.1,1h 41min,"A famous Bollywood actress, Kiran, meets a lesbian journalist, Karen - 3 days before the release of her international film - 'A Himalayan Love Story'."
tt0841012,Kevin Willmott,"Greg Hurd, Kevin Willmott",4.6,2008,"When former Wall Street executive Peter Salem is released from prison, he heads for the small town of Bunker Hill, Kansas, where his ex-wife and their children have started a new life. Soon after he arrives in town, all power is lost - there is no electricity, and cars and computers suddenly shut down. Community leaders are at a loss to explain. Is it the rapture? A m... Leer todo"
tt0841922,Amat Escalante,"Amat Escalante, Martín Escalante",6.2,1h 30min,"Jesus and Fausto, two low-paid Mexican laborers working illegally across the border in LA, are offered big money and a sawn-off shotgun to break into the home of a drug addicted single mother and take her hostage."
tt0842675,Murilo Pasta,Murilo Pasta,5.6,1h 39min,"Marco, a wheelchair user, is a lonely Spanish smuggler , driving through Brazil to sell out his cheap goods. When two bandits assault him and steal his load, he is miraculously saved by Carmo, a beautiful local girl who would rather die than spend another day in the hellhole where she lives. Carmo and Marco will start a lawless, reckless journey, and an intense romanc... Leer todo"
tt0843841,Lovisa Inserra,Lovisa Inserra,7.4,1h 13min,"Buster's the story of a guy that anyone in his right mind would run away from. Or should run away from, since Buster spends all his spare time provoking strangers into fights, then refusing to defend himself as they pummel him 'til they grow bored. He's also a grifter, sucking his brother dry, and a cancer, sabotaging his brother's relationship with his girlfriend. Th... Leer todo"
tt0844286,Rian Johnson,Rian Johnson,6.7,1h 54min,
tt0844457,Philipp Stölzl,"Chris Silber, Philipp Stölzl, Rupert Henning",7.4,2h 6min,
tt0846033,Eric Manning,"Randor Guy, Jason Krieger, Eric Manning",4.6,1h 27min,"Set in a mystic land, The films looks into the relationship between lust, passion and free will against black magic."
tt0846308,Patricia Rozema,"Ann Peacock, Valerie Tripp",6.5,1h 41min,"Set in Cincinnati at the height of the Great Depression, Kit Kittredge, a resourceful young girl, helps her mother run a boardinghouse after her father loses his job."
tt0847214,Robert Logevall,"Scott Coffey, Haruki Murakami",5.1,1h 25min,"In Korea Town Los Angeles, a young man, Kengo, believes he's the son of God - that's what his mother told him since he was a young boy. He spends his days working his dead-end job and figuring out his complex feelings for his girlfriend until, one day, he sees a one-eared man who could be his father and decides to follow him around Los Angeles."
tt0847770,Eddy Terstall,Eddy Terstall,6.8,1h 40min,"Vox Populi is a black comedy about an experienced politician suffering from a midlife crisis. When he comes into contact with the common-man's logic of his new in-laws, this has a far-reaching effect on both his political and his personal life."
tt0847901,Anne Riitta Ciccone,Anne Riitta Ciccone,7.2,2h 3min,"Three different stories in three different European countries, which are intertwined and almost echo each other. A young hostess afraid of flying, a painter working with a young talented Romani girl and a reporter who is in a state of trauma through experiences from war, keeping him from functioning normally and working."
tt0848638,Kalaprabhu Thanu,,3.0,1h 58min,"Yuvraj and Deepali's relationship goes through several challenges when Yuvraj's cousin Reema, who loves Yuvraj, tries to interfere in their lives."
tt0850674,Spencer Parsons,"Line Langebek Knudsen, Spencer Parsons",6.5,1h 52min,
tt0853186,Andrey Slabakov,Andrey Slabakov,6.6,1h 40min,Two very similar families are settling in two identical houses in a new fashionable neighborhood built near a complex of panel-apartment buildings. The couples are in their forties. The husbands are moderate professionals and the wives are housewives without children and with firmly fixed habits. Step by step they find out how similar they are and step by step they co... Leer todo
tt0851532,Kaige Chen,"Kaige Chen, Geling Yan, Kuo-Fu Chen",6.7,2h 30min,"A biographical account of Mei Lanfang, China's greatest opera star."
tt0853129,Mircea Daneliuc,Mircea Daneliuc,5.7,1h 31min,"In a village where bird flu is declared, three young men eager to immigrate get in touch with a businessman who may facilitate their entry into the Foreign Legion."
tt0852982,Adam Martin,Arnfinn Christensen,4.4,1h 40min,"Sarah Good is a 14 year old American girl and a talented show jumper. Therefore, no one understands why she suddenly loses control of her horse at a show, and badly injures herself. Sarah herself knows why she fell. In the middle of her jump she had a vision of her long lost grandmother Gudrun Schillingmeyer saying good bye. At the same time an old lady is put to rest... Leer todo"
tt0855006,"Derrick 'D-Reck' Dixon, Trey Haley","Derrick 'D-Reck' Dixon, CJ Johnson, Chris Johnson",5.8,1h 30min,"Movie that chronicles Mikes Jones' real life rise to fame as an aspiring rapper from the streets who finds his path in life through music in his hometown of Houston, Texas."
tt0855852,Yôji Yamada,"Teruyo Nogami, Yôji Yamada, Emiko Hiramatsu",7.6,2h 13min,Based on childhood days of Teruyo Nogami.
tt0856778,Neil Thompson,"Geoff Thompson, Jim Cartwright",6.7,1h 35min,"An underworld drama set in the early 1980s, about a lonely factory worker whose life is transformed when he becomes a nightclub doorman."
tt0858479,Noam Murro,Mark Poirier,6.1,1h 35min,Into the life of a widowed professor comes a new love and an unexpected visit from his adopted brother.
tt0859644,Chris J. Ford,Chris J. Ford,6.8,1h 39min,A fading smalltime barber is forced to hire the last person on earth he'd want working in his shop - a woman.
tt0860870,"Logan Miller, Noah Miller","Logan Miller, Noah Miller",5.7,1h 48min,The true story about a father struggling to make amends with his twin sons as they pursue their dreams of professional baseball.
tt0861689,Fernando Meirelles,"José Saramago, Don Mc, Kellar",6.5,2h 1min,
tt0861779,Lindsey Christian,"Sia Barnes, Erica Chamblee, Lindsey Christian",5.4,1h 19min,"When Jasmine ""Jazz"" Morgan loses her mother to a long-time battle with lung cancer, she can only focus on one thing - becoming a famous singer. Ignoring the wishes of her father, Blair Morgan a strict doctor who prefers that she return to college, Jazz spends the summer entrenched in the hyper-sexualized, drug-influenced DC music scene, dragging along her younger, mor... Leer todo"
tt0862846,Christine Jeffs,Megan Holley,6.8,1h 31min,
tt0865297,Elissa Down,"Elissa Down, Jimmy The Exploder",7.2,1h 37min,
tt0866435,Geo Santini,"Jason Hice, Geo Santini, Christine Conradt",5.5,1h 35min,"When Troy turned on crime boss Dmitri Debartolla he was forced to leave Los Angeles and lay low in Miami. After two years, and the loss of his leg in a shootout with a Cuban crime syndicate, Troy returns to LA to reclaim what is rightfully his. A reunion with his former partners in a rundown hotel sets the stage for an explosive encounter where past and present collid... Leer todo"
tt0864761,Saul Dibb,"Jeffrey Hatcher, Anders Thomas Jensen, Saul Dibb",6.9,1h 50min,
tt0865554,Gregor Jordan,"Bret Easton Ellis, Nicholas Jarecki",4.9,1h 38min,
tt0867411,Richard Kaponas,Brian Eric Johnson,5.1,1h 35min,
tt0867591,Vince Di Meglio,"Tim Rasmussen, Vince Di Meglio",4.6,1h 32min,
tt0867295,Douglas A. Raine,"Scott Kenyon Barker, Douglas A. Raine",3.5,1h 24min,A documentary filmmaker finds himself drawn into the seedy world of a snuff filmmaker with a mysterious dark side.
tt0867334,Dan Ireland,"Dennis Yares, E.L. Doctorow, Michael Gilio",6.4,2h 1min,
tt0867270,Charlie Levi,Charlie Levi,5.2,1h 30min,"Katherine is a typical teenager. Today's her funeral. The four adults in her life have a lot on their mind - and it's not all about Katherine either. With a frankness that's strikingly disarming as well as frequently self-serving, the grown-ups struggle with being... well... grown-up."
tt0870176,Jason Paul Collum,Jason Paul Collum,4.2,1h 43min,"Two years after their loved ones were murdered in obsessive rage, the survivors are dragged into a horrific psychological breakdown - and blood soaked plan for revenge."
tt0870111,Ron Howard,Peter Morgan,7.7,2h 2min,
tt0870118,Daniel Davila,"Karim Ahmad, Daniel Davila, Cliff Traiman",7.4,1h 35min,"In a rundown apartment complex in San Francisco's Tenderloin, a septuagenarian seer is waiting for his final message. For decades the eccentric recluse has chronicled the phrases of the Wheel of Fortune and deciphered their hidden meaning - the details of a mission to save his neighbors from their troubles."
tt0870101,Cornelia Duryée,Cornelia Duryée,4.6,1h 45min,"The Dark Horse is a story of struggle and redemption. Dana, a ballet teacher, reluctantly returns to her childhood home to discover it is about to be sold. To save the farm, and the family, she must tame her mother's dangerous black horse, and ride him to victory in the year's biggest dressage competition."
tt0870089,Yen Tan,"Alessandro Calza, Yen Tan",6.6,1h 27min,
tt0867235,K.P. Kumaran,"Henrik Ibsen, K.P. Kumaran",4.1,PG,"Albert Samson, a successful architect, and Alice are leading an unhappy married life because of Samson's ambitious and egoistic nature. Hilda Varghese enters Samson's life and changes it completely."
tt0867464,Robert Malenfant,"Jacques Haitkin, Jacques Haitkin, Robert Malenfant",4.2,1h 33min,"Matt and Julia aren't having the greatest relationship on earth. They've got a successful advertising agency but Matt suspects his wife of having an affair and is getting so obsessed with this thought that he's actually asked his co-worker Trevor Jones to have her followed. Trevor, who wants to become partner in the company, does as requested and when he brings pictur... Leer todo"
tt0869994,Cédric Klapisch,Cédric Klapisch,6.8,2h 10min,
tt0870204,Christian Duguay,"Agatha Dominik, John Cox",5.8,1h 39min,
tt0870122,"Darren Grodsky, Danny Jacobs","Darren Grodsky, Danny Jacobs",6.2,1h 37min,"A disillusioned medical student is stranded for a summer in a remote community of counterculture pot farmers, the last place in the world he imagined he would discover himself."
tt0871438,Sarab Neelam,"Sarab Neelam, V. Prasad",7.0,1h 37min,"As a Sikh man with a full beard and turban, Amrit Singh is often the target of racial profiling. But when he sees his dreams of becoming Chief of Surgery at a state-of-the-art transplant center dwindle because of his appearance, Amrit goes against a tradition he's maintained his whole life and cuts his hair. Hiding this decision from his girlfriend and family in Toron... Leer todo"
tt0872245,Duane Hopkins,Duane Hopkins,5.2,1h 33min,"A group of young people grow up together in a small, rural community in the Cotswolds."
tt0874425,Tate Taylor,Tate Taylor,4.9,1h 39min,"Lucy has always used food to escape life's problems, but when this self-titled ""fat friend"" lures her group of old college buddies to the Montana wilderness, she reveals a new self - skinny, beautiful and still flawed."
tt0876233,Geoffrey Haley,Geoffrey Haley,6.2,1h 30min,A man (Bentley) who makes his living composing other people's suicide notes enters into a romance with the sister (Ryder) of a recent client.
tt0875705,"Hunter Hill, Perry Moore","Hunter Hill, Perry Moore",5.7,1h 33min,"A desperate young man, on the run from a dangerous drug dealer, returns to his mother, years after a family tragedy drove them far apart, to hide. However, his old and new life are about to collide."
tt0875701,Paula van der Oest,Paula van der Oest,6.6,1h 30min,"Bookkeeper Jacob newest client is the talented and flamboyant actress Anne. They first meet each other on her houseboat, the morning after the premiere of Anne's new theatrical play. Jacob soon discovers that Anne has made a mess of her personal finances and that she has several debts. She may even have to sell her houseboat. Anne gets into a blind panic as she defini... Leer todo"
tt0877700,Pascal-Alex Vincent,"Pascal-Alex Vincent, Olivier Nicklaus, Martin Drouot",5.8,1h 20min,Twin 18-year-olds hitchhike to their mother's funeral in Spain. The journey changes their lives forever.
tt0878700,Michael Almereyda,"Michael Almereyda, Katya Apekina, James Robison",5.7,1h 18min,"A year after Hurricane Katrina, Henry, a surgeon in the affluent Garden District of New Orleans, is attempting to get his life back on track. He is remarrying his ex-wife, renovating her house and restarting his medical practice. But things begin to derail when he runs into an old flame, Hyde, a younger woman was has returned to New-Orleans to become a relief worker i... Leer todo"
tt0878709,Peter Kahane,"Kurt Held, Peter Kahane, Ronald Kruschak",5.4,1h 39min,A female-led gang of orphaned teenagers fights corruption.
tt0878818,Georges Terryn,,,,"On Flanders' biggest movie set, Tania, the make-up artiste wants to make her debut in front of the camera. The cast is not amused and teach her how to act."
tt0880648,Edward Anderson,Edward Anderson,5.6,1h 47min,A late night airport shuttle ride home descends into darkness.
tt0884038,Erik S. Weigel,"Salvatore Interlandi, Erik S. Weigel",5.8,1h 31min,"Elliot, 31, a product of the Washington D.C. foster care system, has spent most of his life moving from place to place. When he is contacted by Matthew, a childhood friend from ""the system"" dying of cancer, Elliot goes to be by his side. At the funeral, he meets Gray and Lily, two friends of Matthew, both aimless in their present lives. Motivated by their sense of los... Leer todo"
tt0882765,Matthew Miele,Matthew Miele,5.3,1h 39min,Ensemble drama about conversations overheard in a bistro: two chess players see unfolding dramas; a couple endures an uncomfortable blind date; a marriage crumbles; and film-noir fans think that they're witnessing a real-life murder.
tt0882978,Daniel Lee,"Ho-Leung Lau, Daniel Lee, Guanzhong Luo",6.1,1h 42min,
tt0885398,Anant Mahadevan,"Daphne Du Maurier, Anant Mahadevan, Sameer",3.8,2008,"Middle-classed, slender and petite Jia Rao meets Gajner's recently widowed Kunver Vikram Aditya Singh Sesodia, both fall in love, get married, and re-locate to live in his palace in Rajasthan. Jia finds out that everyone in the vicinity still believes that Vikram's first wife, Anamika, who allegedly met a sudden death, may still be alive, and actually witnesses an app... Leer todo"
tt0886472,Carlos González Morantes,"Carlos González Morantes, César Jaime",6.5,1h 30min,Dirección
tt0887883,"Ethan Coen, Joel Coen","Joel Coen, Ethan Coen",7.0,1h 36min,
tt0886531,Jaffar Mahmood,Jaffar Mahmood,7.0,1h 26min,"Ray's half Pakistani and half white. When his parents' marriage dissolves, Ray's perspective of Ms. Right falls deeply into question."
tt0888693,Bill Maher,Zac Stanford,6.1,1h 41min,The drama follows a twelve-year-old girl's struggle to come to terms with her mother's abandonment.
tt0886476,Shawn Garry,Trinidad Jiménez,6.1,1h 40min,"A young Spanish girl develops an acute emotional crisis after her mother's death. When a letter written by the deceased mother surfaces, the grieving daughter departs to South America for answers."
tt0888688,Todd Densmore,Todd Densmore,,,"Rob, Kevin, and Cameron walk through a life of drugs, women, and stealing to get by. But when a dark secret is brought to light, the three embark on a journey of self-realization and finally find out what it is like to feel again."
tt0887971,Susan Montford,"Edward Bryant, Susan Montford",4.8,1h 26min,"A woman out late for Christmas Eve shopping is soon terrorized by a small gang of troublemakers, and she must fight for her life."
tt0887912,Kathryn Bigelow,Mark Boal,7.5,2h 11min,
tt0889134,Peter Tolan,Peter Tolan,5.5,1h 36min,A television producer with a penchant for drinking and gambling is sent to Las Vegas to convince his troubled niece to enter rehab.
tt0889588,Roger Spottiswoode,"Jane Hawksley, James Mac, Manus, Simon van der Borgh",7.0,2h 5min,
tt0889595,James Bolton,"James Bolton, Jim Grimsley",6.2,1h 28min,"Based on the novel ""Dream Boy"" by Jim Grimsley, this film chronicles the relationship between two gay teenagers in the rural south in the late 70's."
tt0891549,Róbert Alföldi,"Róbert Alföldi, Attila Bartis, Betti Berényi",5.9,1h 48min,Dirección
tt0892255,Steven Soderbergh,"Peter Buchman, Ernesto 'Che' Guevara",7.1,2h 14min,
tt0892393,John Lavachielli,John Lavachielli,7.5,2008,Dirección
tt0893325,John Krueger,John Krueger,5.1,1h 50min,Two brothers are forced to confront a terrible crime that was hidden in their past.
